Author,Date,Title,Journal,Journal ID,Volume,Page Start,Page End,Keword,Keword2,Reprint,LookupNumber,PDF
"Mundahl, N.D. and K.J. Kraft.",1988.,Abundance and growth of three species of aquatic insects exposed to surface-release hydropower flows.,,1509,7,100,108,"Ephemeroptera, Ephemerellidae, Ephemerella subvaria, invaria, stream regulation, growth rate, production, temperature, emergence, Michigan, pollution.",,0,358,1
"Munn, Mark D. and Robert H. King.",1987.,Life history of ^Potamanthus myops^ (Walsh) (Ephemeroptera: Potamanthidae) in a Central Michigan stream.,,29,117,119,125,"Ephemeroptera, Potamanthidae, Potamanthus, life history",,0,121,1
"Murphy, H.E.",1922.,Notes on the biology of some of our North American species of may-flies.,,1903,Bulletin 22,46 pages,,"biology, metamorphosis, mouth parts",,1,756,0
"Murphy, M.L., C.P. Hawkins, and N.H. Anderson.",1981.,Effects of canopy modification and accumulated sediment on stream communities.,,931,110,469,478,"Canopy, temperature, pollution, logging",,0,363,1
"Naiman, Robert J., John J. Magnuson, Diane M. McKnight, Jack A. Stanford, James R. Karr.",1995.,Freshwater Ecosystems and Their Management: A National Initiative.,,1835,270,584,585,"management, ecology, pollution, biodiversity,",,0,494,1
"Navas, L.",1934.,N関ropt鑢es et insectes voisins. Chine et pays environnants. Sixi鑝e [VI] s閞ie,,266,1 (14),1,8,,,0,1035,1
"Nav醩, L.",1933.,N関ropt鑢es et insectes voisins. Chine et pays environnants. Cinqui鑝e [V] s閞ie.,,266,1(13),1,10,,,0,1036,1
"Nav醩, L.",1933., N関ropt鑢es et insectes voisins. Chine et pays environnants. Quatri鑝e [IV] s閞ie.,,266,1(9),1,22,,,0,1037,1
"Needham, J.G.",1927.,The life history and habits of a mayfly from Utah.,,116,59,133,136,"Ephemeroptera, life history, ecology, life cycle, Heptageniidae, Rhithrogena mimus",,0,326,1
"Needham, J.G.",1927.,A baetine mayfly nymph with tusked mandibles.,,116,59,44,47,"Ephemeroptera, Leptophlebia packii,",,0,329,0
"Needham, J.G.",1917-18.,"[Issued July 17, 1920] Burrowing mayflies of our larger lakes and streams.",,1880,36,269,292,"Ephemeroptera, Ephemeridae, Pentagenia, Ephemera, Hexagenia, Polymitarcyidae, Potamanthiidae, Anthopotamus",,1,394,0
"Needham, J.G.",1920.,African stone-flies and may-flies collected by the American Museum Congo Expedition.,,58,43,35,40,"Africa, Ephemeridae, Pentagenia schoutedeni, Caenopsis fugitans",,0,927,0
"Needham, J.G. and H.E. Murphy.",1924.,Neotropical Mayflies.,,83,Bulletin 24,79 pages,,"Neotropical, South America, new species",,1,763,0
"Newell, R.T. and G.W. Minshall.",1978.,"Life history of a multivoltine mayfly, ^Tricorythodes minutus^: an example of the effect of temperature on the life cycle.",,15,71,876,881,"Leptohyphidae, Tricorythodes minutus, life history, Minnesota",,0,676,1
"Nichols, B.J. and R.W. Sites.",1999.,Life histories of lotic mayflies (Ephemeroptera) in an Ozark stream: instar determination and voltinism.,,309,101,779,787,"Stenonema, Caenis, Tricorythodes, Missouri, life history",,1,581,1
"Nieto, C. and E. Dominguez.",2001.,A new species of ^Thraulodes^ (Ephemeroptera: Leptophlebiidae) from Mexico.,,423,23,63,66,"Leptophlebiidae, Mexico, Thraulodes cryptodrilus",,0,770,0
"Nieto, Carolina",2004,"Redescription of ^Varipes^ (Ephemeroptera: Baetidae), with the description of new species from Bolivia and Argentina.",,423,26,161,173,"Baetidae, Varipes, Bolivia, Argentina",,0,983,1
"Nieto, Carolina and Frederico Falca[o] Salles",2006.,Revision of the genus ^Paracloeodes^ (Ephemeroptera: Baetidae) in South America.,,1917,1303,1,33,"Baetidae, Paracloeodes, South America",PDF,0,1081,1
"Nieto, Carolina.",2004.,"The genus ^Baetodes^ (Ephemeroptera: Baetidae) in South America with the description of new species from Argentina, Bolivia and Peru.",,1395,39,63,79,"Baetidae, Baetodes, South America",,0,992,1
"Nieto, Carolina.",2010.,Cladistic analysis of the family Baetidae (Ephemeroptera) in South America.,Systematic Entomology,,35,512,525,"Ephemeroptera, Baetidae, systematics, South America",,0,1151,1
"Nolte, Ulrike, Rosane S. Tietbohl, and W. Patrick McCafferty.",1996.,A mayfly from tropical Brazil capable of tolerating short-term dehydration.,,1509,15,87,94,"Ephemeroptera, Baetidae, Cloeodes, ecology, life history, dehydration",,0,492,1
"O'Donnell, Brigid C.",2009,Early Nymphal Development in ^Ephoron leukon^ (Ephemeroptera Polymitarcyidae) with Particular Emphasis on Mouthparts and Abdominal Gills,,15,102,128,136,"Ephoron leukon, development, gills, ontogeny",,0,1139,0
"Ogden, T. Heath, Michel Sartori, and Michael F. Whiting.",2008.,"Pisciforma, Setisura, and Furcatergalia (Order: Ephemeroptera) are not monophletic based on 18S rDNA sequences: A response to Sun et al. (2006).",,15,101,1,6,"Ephemeroptera, molecular, 18S, rDNA, phylogeny",PDF,0,1132,1
"Ogden, T.H. and M.F. Whiting.",2003.,"The problem with ""the Paleoptera Problem:"" sense and sensitivity",Cladistics,,19,432,442,"Ephemeroptera, Paleoptera, evolution, molecular",,0,995,1
"Oliarinony, R., M. Sartori, and Jean-Marc Elouard.",2000.,"Premiere description des larves et des oeufs du genre malgache ^Madecassorythus^ (Ephemeroptera, Tricorythidae).",Bulletin de la Societe Entomologique Suisse,,73,369,378,"Tricorythidae, Madecassorythus, Madagascar",,1,982,0
"Ormerod, S.J. and R.W. Edwards.",1987.,The ordination and classification of macroinvertebrate assemblages in the catchment of the River Wye in relation to environmental factors.,,666,17,533,546,"Ecology, statistics, correlation, multiple discriminant analysis, twinspan",,0,277,1
"Paclt, J.",1994.,"^Ephacerella^, a replacement name for ^Acerella^ Allen, 1971 (Ephemeroptera), nec Berlese, 1909 (Protura).",,141,105,283,284,"Ephemeroptera, Ephemerellidae, Ephacerella, Acerella",,1,526,1
"Pennak, Robert W.",1947.,Keys to the aquatic insects of Colorado.,"University of Colorado Studies, Series D (Physical and Biological Sciences)",0,2,353,383,"Colorado, taxonomy",,1,863,0
"Perry, S.A., W.B. Perry, and J.A. Stanford.",1986.,"Effects of stream regulation on density, growth, and emergence of two mayflies (ephemeroptera: Ephemerellidae) and a caddisfly (Trichoptera: Hydropsychidae) in two Rocky Mountain rivers (U.S.A.).",,873,64,656,666,"Ephemeroptera, Ephemerellidae, Ephemerella, Drunella flavilinea, Serratella tibialis, stream regulation, production, emergence, pollution",,0,359,1
"Pescador, M.L.",1997.,^Gonserellus^: A new genus of Leptophlebiidae (Ephemeroptera) from Southern South America.,,423,4,237,242,"Leptophlebiidae, Gonserellus, South America, Chile",,1,543,0
"Pescador, M.L. and B.A. Richard.",2006.,"A new species of ^Caenis^ (Ephemeroptera: Caenidae) from Florida, USA.",,1917,1355,61,68,"Caenidae, Caenis eglinensis, Florida, new species",PDF,0,1096,1
"Pescador, M.L. and G.F. Edmunds, Jr.",1994.,New genus of Oligoneuriidae (Ephemeroptera) from South America.,,15,87,263,269,"Ephemeroptera, Oligoneuriidae, Fittkauneuria, South America",,1,347,1
"Pescador, M.L. and J.G. Peters.",2007.,A new genus of Oligoneuriidae (Ephemeroptera) from Madagascar.,,15,100,173,177,"Oligoneuriidae, Rianilaneuria diminuta, Madagascar",PDF,0,1098,1
"Pescador, M.L. and L. Berner.",1981.,The mayfly family Baetiscidae (Ephemeroptera). Part II Biosystematics of the genus ^Baetisca^.,,376,107,163,228,"Baetiscidae, Baetisca",,1,560,0
"Pescador, M.L. and W.L. Peters",1980,A revision of the genus ^Homoeoneuria^ (Ephemeroptera: Oligoneuriidae).,,376,106,357,393,"Ephemeroptera, Oligoneuriidae, Homoeoneuria, revision, systematics, fittkaui, cahabensis, ammophila, alleni, salviniae, dolani",,1,86,0
"Pescador, M.L. and W.L. Peters.",1974,The life history and ecology of ^Baetisca rogersi^ Berner (Ephemeroptera: Baetiscidae).,,1847,17,151,209,"Ephemeroptera, Baetiscidae, Baetisca, life history, ecology",,1,44,0
"Pescador, M.L. and W.L. Peters.",1985.,Biosystematics of the genus ^Nousia^ from Southern South America (Ephemeroptera: Leptophlebiidae: Atalophlebiinae).,,214,58,91,123,"Ephemeroptera, Leptophlebiidae, Nousia, South America, systematics",,0,112,1
"Pescador, M.L. and W.L. Peters.",1982.,Four new genera of Leptophlebiidae (Ephemeroptera: Atalophlebiinae) from Southern South America.,,423,4,1,19,"Ephemeroptera, Leptophlebiidae, Archethraulodes, Demoulinellus, Rhigotopus, Secochela, taxonomy, South America",,1,206,0
"Pescador, M.L. and W.L. Peters.",1991.,Biosystematics of the genus ^Penaphlebia^ (Ephemeroptera: Leptophlebiidae: Atalophlebiiane) from South America.,,376,117,1,38,"Ephemroptera, Leptophlebiidae, Penaphlebia, taxonomy, South America",,1,207,1
"Pescador, M.L. and W.L. Peters.",1990.,Biosystematics of the genus ^Massartella^ Lestage (Ephemeroptera: Leptophlebiidae: Atalophlebiinae) from South America.,,423,12,145,160,"Ephemeroptera, Leptophlebiidae, Massartella, alegrettae, brieni, South America,",,1,313,0
"Pescador, M.L. and W.L. Peters.",1971.,The imago of ^Baetisca becki^ Schneider and Berner (Baetiscidae: Ephemeroptera).,,165,54,329,334,"Baetiscidae, Baetisca",,1,586,0
"Pescador, M.L. and W.L. Peters.",1980.,Two new general of cool-adapted Leptophlebiidae (Ephemeroptera) from Southern South America.,,15,73,332,338,"Leptophlebiidae, Dactylophlebia, Magallanella, Chile, Argentina",,1,589,0
"Pescador, M.L..",1985.,Systematics of the Nearctic genus ^Pseudiron^ (Ephemeroptera: Heptageniidae: Pseudironinae).,,165,68,432,444,"Ephemeroptera, Heptageniidae, Pseudiron, systematics",,1,74,0
"Pessacq, Pablo, and Maria Laura Miserendino.",2008,"Ephemeroptera and Plecoptera biodiversity in central Patagonia, Chubut province, Argentina",,1917,1817,27,38,"Ephemeroptera, Argentina, Patagonia",PDF,0,1147,1
"Peters, J.G. and W.L. Peters.",1986.,Leg abscission and adult ^Dolania^ (Ephemeroptera: Behningiidae).,,165,69,245,250,"Ephemeroptera, Behningiidae, Dolania, ecology",,1,129,1
"Peters, J.G., R.W. Flowers, M.D. Hubbard, E. Dominguez, & H.M. Savage.",2005.,New records and combinations for Neotropical Leptophlebiidae (Ephemeroptera).,,1917,1054,51,60,"Leptophlebiidae, Neotropics, Atalophlebiinae, Hagenulus, Hermanella, Choroterpes, Terpides, Tikuna, Ulmeritoides",,0,1043,1
"Peters, W.L.",1988,"Origins of the North American Ephemeroptera fauna, especially the Leptophlebiidae.",,243,144,13,24,"Ephemeroptera, biogeography, Leptophlebiidae",,1,30,1
"Peters, W.L.",1971.,A revision of the Leptophlebiidae of the West Indies (Ephemeroptera).,,1040,62,1,48,"Leptophlebiidae, West Indies, Farrodes, Careospina, Neohagenulus, Traverina, Hagenulus, Borinquena",,1,409,1
"Peters, W.L.",1969.,^Askola froehlichi^ a new genus and species from Southern Brazil (Leptophlebiidae: Ephemeroptera).,,165,52,253,258,"Leptophlebiidae, Askola, Brazil",,1,583,1
"Peters, W.L.",1975.,A new species of ^Indialis^ from India.,,323,51,159,161,"Leptophlebiidae, Indialis, India",,1,584,1
"Peters, W.L.",1981.,"^Coryphorus aquilus^, a new genus and species of Tricorythidae from the Amazon Basin (Ephemeroptera).",,423,3,209,217,"Tricorythidae, Coryphorus, Brazil, Columbia",,1,599,1
"Peters, W.L.",1980.,"^Choroterpes (Choroterpes) lindrothi^, a new species of mayfly from Morocco (Ephemeroptera: Leptophlebiidae).",,706,6,371,373,"Leptophlebiidae, Choroterpes, Morocco",,1,608,1
"Peters, W.L.",1980.,"Results of the Austrian Hydrobiological Mission, 1974, to the Seychelles-, Comores- and Mascarene Archipelagos. Part VIII: The Leptophlebiidae of the Seychelles and Comoro Islands.",,34,83,733,740,"Leptophlebiidae, Hagenulodes, Mahethraulus, Thraulus, Choroterpes, Comoro Islands",,1,613,0
"Peters, W.L.",1972,The nymph of ^Dipterophlebiodes^ sp. (Leptophlebiidae: Ephemeroptera).,,141,83,53,56,"Leptophlebiidae, Dipterophlebiodes",,1,634,1
"Peters, W.L.",1994,In Memorian: Dr. Yin-Chi Hsu.,,165,77,389,391,,,1,635,1
"Peters, W.L.",1971,Entomology of the Aucklands and other islands south of New Zealand: Ephemeroptera: Leptophlebiidae.,,314,27,47,51,"Leptophlebiidae, Atalophlebioides, Auckland Islands, New Zealand",,1,650,1
"Peters, W.L. and A.D. Harrison.",1974.,"Redescription of ^Terpides^ Demoulin from St. Vincent, West Indies (Ephemeroptera: Leptophlebiidae).",,309,76,178,185,"Leptophlebiidae, Terpides, St. Vincent, West Indies",,1,585,1
"Peters, W.L. and G.F. Edmunds, Jr.",1966.,The nymph of ^Hagenulodes^ Ulmer (Ephemeroptera: Leptophlebiidae).,,537,35,26,28,"Leptophlebiidae, Hagenulodes braueri, Ethopia",,1,449,1
"Peters, W.L. and G.F. Edmunds, Jr.",1970.,Revision of the generic classification of the Eastern Hemisphere Leptophlebiidae.,,312,2,157,240,"Leptophlebiidae, Asia, systematics, evolution, phylogeny, Leptophlebiidae",,1,453,0
"Peters, W.L. and G.F. Edmunds, Jr.",1972.,A Revision of the Generic Classification of Certain Leptophlebiidae from Southern South America (Ephemeroptera).,,15,65,1398,1414,"Ephemeroptera, Leptophlebiiidae, Massartella, Atalonella, Massartellopsis, Penaphlebia, Hapsiphlebia, Meridialaris, South America, systematics",,1,483,0
"Peters, W.L. and G.F. Edmunds, Jr.",1964.,A revision of the generic classification of the Ethiopian Leptophlebiidae (Ephemeroptera).,,386,116,225,253,"Leptophlebiidae, Ethopia,",,1,576,0
"Peters, W.L. and J.G. Peters.",1993.,Status changes in Leptohyphidae and Tricorythidae (Ephemeroptera).,,423,15,45,48,"Tricorythidae, Leptohyphidae, Coryphorus, Tricorythafer, Tricorythodes, Tricorythodes fugitanus, Machadorythus, Teloganella",,1,311,0
"Peters, W.L. and J.G. Peters.",1979-1980.,The Leptophlebiidae of New Caledonia (Ephemeroptera). Part II-Systematics.,"Cah. O.R.S.T.O.M., ser. Hydrobiol. 13:61-82.",,,,,"New Caledonia, Leptophlebiidae, Celiphlebia, Poya, Tindea, Peloracantha, Coula",,0,503,1
"Peters, W.L. and J.G. Peters.",1981.,The Leptophlebiidae:  Atalophlebiinae of New Caledonia (Ephemeroptera). Part III-Systematics.,,1884,14,233,243,"New Caledonia, Leptophlebiidae, Notachalcus, Ounia",,0,504,1
"Peters, W.L. and J.G. Peters.",1981.,The Leptophlebiidae:  Atalophlebiinae of New Caledonia (Ephemeroptera). Part IV-Systematics.,,1884,14,245,252,"New Caledonia, Leptophlebiidae, Kariona, Papposa",,0,505,1
"Peters, W.L. and J.G. Peters.",1977.,Adult life and emergence of ^Dolania americana^ in northwestern Florida (Ephemeroptera: Behningiidae).,,1886,62,409,438,"Behningiidae, Dolania, Florida",,1,561,0
"Peters, W.L. and L.O. Warren.",1966.,Seasonal distribution of adult Ephemeroptera in northwestern Arkansas.,,214,39,396,401,"Ephemeroptera, life cycles, life history, emergence patterns",,1,300,0
"Peters, W.L. and Luiz Silveira Whytton da Terra.",1974.,Description of the nymph and the phylogenetic relationships of ^Calliarcys^ Eaton from Portugal (Ephemeroptera: Leptophlebiidae).,Ciencia Biologica (ortugal) 1(3):61-69.,,,,,"Leptophlebiidae, Calliarcys, Portugal",,1,582,0
"Peters, W.L., J.G. Peters, and G.F. Edmunds, Jr.",1978.,The Leptophlebiidae of New Caledonia (Ephemeroptera).  Part I-Introduction and systematics.,"Cah. O.R.S.T.O.M., ser. Hydrobiol., 12(2):97-117.",,,,,"Ephemeroptera, New Caledonia, Leptophlebiidae, systematics, biogeography, Lepeorus, Lepegenia",,1,482,1
"Peters, W.L., J.G. Peters, and G.F. Edmunds, Jr.",1990.,The Leptophlebiidae:  Atalophlebiinae of New Caledonia (Ephemeroptera). Part V-Systematics.,,1884,23,121,140,"New Caledonia, Leptophlebiidae, Fasciamirus, Simulacala, Kouma",,1,506,1
"Peters, W.L., J.G. Peters, and G.F. Edmunds, Jr.",1994.,The Leptophlebiidae:  Atalophlebiinae of New Caledonia (Ephemeroptera). Part VI-Systematics.,,1884,27,97,105,"New Caledonia, Leptophlebiidae, Tenagophila",,1,507,1
"Peters, William L.",1959,A New Species of ^Callibaetis^ from Kansas (Ephemeroptera: Baetidae),Journal of the Kansas Entomological Society,,32,173,175,,,0,1175,1
"Peters, William L.",1963,A New Species of ^Habrophlebiodes^ from China (Ephemeroptera : Leptophlebiidae),Proc. R. Ent. Soc. Lond.,,32,41,43,,,0,1176,1
"Peters, William L.",1967,New Species of ^Prosopistoma^ from the Oriental Region (Prosopistomatoidea : Ephemeroptera),Tijdschrift Voor Entomologie,,110,207,222,,,0,1177,1
"Petr, T.",1970,The Bottom Fauna of the Rapids of the Black Volta River in Ghana,Hydrobiologia,,36,399,418,,,0,1178,1
"Pettry, D. K. and D. C. Tarter.",1985.,"Ecological life history of ^Baetisca carolina^ Traver in Panther Creek, Nicholas County, West Virginia (Ephemeroptera: Baetiscidae).",,290,92,355,368,"Ephemeroptera, Baetiscidae, Baetisca, life history, life cycle, ecology",,0,165,0
"Phillips, E.C. and R.V. Kilambi.",1994.,Utilization of coarse woody debris by Ephemeroptera in three Ozark Streams of Arkansas.,,1827,39,58,62,"Ephemeroptera, ecology, woody debris, biology, snags",,0,249,1
"Phillips, E.C., R.V. Kilambi, and C.E. Carlton.",1994.,"Life history and secondary production of ^Ephoron album^ (Say) (Ephemeroptera: Polymitarcyidae) in the Illinois River, Arkansas.",,214,67,242,247,"Ephemeroptera, Polymitarcyidae, Ephoron album, life history, secondary production, ecology, life cycle",,0,411,1
"Poff, N. LeRoy, and James V. Ward.",1988.,Use of occupied ^Glossosoma verdona^ (Trichoptera: Glossosomatidae) cases by early instars of ^Baetis^ spp. (Ephemeroptera: Baetidae) in a Rocky Mountain Stream.,,141,99,97,101,"Ephemeroptera, Baetidae, Baetis, ecology, Trichoptera",,0,169,1
"Polegatto, C.M. and J.D. Batista.",2007.,"^Hydromastodon sallesi^, a new genus and new species of Atalophlebiinae (Insecta: Ephemeroptera: Leptophlebiidae) from West and North of Brazil, and notes on systematics of ^Hermanella^ group.",,1917,1619,53,60,"Hydromastodon sallesi, Hermanella, Brazil, Atalophlebiinae",PDF,0,1127,1
"Poole, Walton C., Stewart, Kenneth W.",1975,"The vertical distribution of macrobenthos within the substratum of the Brazos River, Texas",Hydrobologia,,50,151,160,"ecology, stream substratum, Texas, Brazos River",,0,1157,0
"Pringle, C.M. and N.G. Aumen.",1993.,Current issues in freshwater conservation: introduction to a symposium.,,1509,12,174,176,"conservation, freshwater",,0,368,1
"Pringle, C.M., C.F. Rabeni, A.C. Benke, and N.G. Aumen.",1993.,The role of aquatic science infreshwater conservation: cooperation between the North American Benthological Society and organizations for conservation and resource management.,,1509,12,177,184,"conservation, management, freshwater resources, aquatic ecology",,0,369,1
"Pritchard, G. and J. Zloty.",1994.,"Life histories of two ^Ameletus^ mayflies (Ephemeroptera) in tow mountain streams: the influence of temperature, body size, and parasitism.",,1509,13,557,568,"Ephemeroptera, Ameletus celer, similor, life history, temperature, growth rate, parasitism, life cycle, Canada",,1,443,1
"Provonsha, A.V. and W.P. McCafferty.",1985.,^Amercaenis^: new Nearctic genus of Caenidae (Ephemeroptera).,,1872,1,1,7,"Caenidae, Amercaenis, Amercaenis ridens, Caenis ridens, mayflies, Ephemeroptera",,0,252,1
"Provonsha, A.V. and W.P. McCafferty.",1982.,New species and previously undescribed larvae of North American Ephemeroptera.,,214,55,23,33,"Ephemeroptera, Siphlonurus minnoi, Pseudocloeon cestum, Siphlonurus typicus, Isonychia sicca, ecology, taxonomy, systematics",,1,255,1
"Provonsha, A.V. and W.P. McCafferty.",1995.,New brushlegged caenid mayflies from South Africa (Ephemeroptera: Caenidae).,,423,17,241,251,"Barnardara, Caenidae, Africa, Clypeocaenis, South Africa",,1,922,0
"Provonsha, A.V. and W.P. McCafferty.",2006.,A second species of the North American mayfly genus ^Amercaenis^ Provonsha and McCafferty (Ephemeroptera: Caenidae),,1775,6,1,6,"Caenidae, Amercaenis cusabo",PDF,0,1080,1
"Provonsha, Arwin V.",1990,A Revision of the Genus ^Caenis^ in North America (Ephemeroptera: Caenidae),Transactions of the American Entomological Society,,116,801,884,,,0,1185,1
"Pugh, J.E.",1956.,Observations of the mayfly fauna of a stream in central Virginia.,,1851,7,22,28,"Ephemeroptera, Virginia, Leptophlebiidae, Heptageniidae, Ephemerellidae, Baetidae, Caenidae",,0,341,1
"Quinn, J.H.",???,Paried river terraces and pleistocene glaciation.,,1895,,,,"biogeography, geology",,0,380,1
"Rader, Russell B. and James V. Ward.",1989.,"Influence of impoundments on mayfly diets, life histories, and production.",,1509,8,64,73,"Ephemeroptera, stream regulation, life history, production",,0,146,1
"Randolph, R.P. and W.P. McCafferty.",1996.,First larval descriptions of two species of Paraleptophlebia.,,141,107,225,229,"Leptophlebiidae, Paraleptophlebia",,1,651,0
"Randolph, R.P. and W.P. McCafferty.",2000.,Mexican mayflies: inventory and additions (Ephemeroptera).,,1871,36,113,121,"Mexico, biodiversity, distribution",,1,693,0
"Randolph, R.P. and W.P. McCafferty.",2000.,A new species of ^Paracloeodes^ (Ephemeroptera: Baetidae) from Mexico.,,141,111,133,136,"Baetidae, Paracloeodes lugoi, Mexico",,1,782,0
"Randolph, R.P. and W.P. McCafferty.",2001.,Nunavut mayflies (Ephemeroptera) a suppliment for Far Northern North America.,,141,112,56,58,"new records, Canada",,1,791,0
"Randolph, R.P. and W.P. McCafferty.",2002.,"First report of genus ^Tortopus^ from Mexico, with additional new records of Mexican Ephemeroptera.",,141,113,34,36,"Mexico, Tortopus, Polymitarcyidae",,0,806,0
"Randolph, R.P. and W.P. McCafferty.",2001.,New species and records of Ephemeroptera (Insecta) from Central Mexico.,,1821,8,15,21,"Mexico, Farrodes reevesi, Camelobaetidius shepardi, Queretaro, new records",,1,808,1
"Randolph, R.P. and W.P. McCafferty.",2005.,"The mayflies (Ephemeroptera) of Alaska, including a new species of Heptageniidae",,309,107,190,199,"Alaska, Heptageniidae, Rhithrogena ingalik, biodiversity, inventory",,0,962,0
"Randolph, R.P., W.P. McCafferty, D. Zaranko, L.M. Jacobus, J.M. Webb.",2002,New Canadian records of Baetidae (Ephemeroptera) and adjustments to North American ^Cloeon^,,141,113,306,308,"Baetidae, Cloeon, Pseudocentroptiloides, Pseudocloeon",,0,880,0
"Rasmussen, Joseph B.",1988,"Habitat requirements of burrowing mayflies (Ephemeridae:^Hexagenia^) in lakes, with special reference to the effects of eutrophication",J. N. Am. Benthol. Soc.,,7,51,64,,,0,1179,1
"Raun, Gerald G.",???,"Terrestrial and aquatic vertebrates of a moist, relict area in central Texas",Texas Journal of Science,,?,158,170,"Texas, ecology, relict habitats",,0,1159,0
"Raven, P.J. and J.J. George.",1989.,Recovery by riffle macroinvertebrates in a river after a major accidental spillage of Chlorpyrifos.,,1869,59,55,70,"pollution, England,",,0,389,1
"Reisen, W.K.",1975.,"The ecology of Honey Creek, Oklahoma: Spatial and temporal distributions of the macroinvertebrates.",,1833,55,25,31,"Ecology, statistics, Oklahoma",,0,280,1
"Resh, V.H. and J.D. Unzicker.",1975.,Water quality monitoring and aquatic organisms: the importance of species identification.,,1859,47,9,19,"pollution, water quality",,0,375,1
"Richardson, Mickie Y. and Donald C. Tarter.",1976.,Life histories of ^Stenonema vicarium^ (Walker) and ^S. tripunctatum^ (Banks) in a West Virginia stream (Ephemeroptera: Heptageniidae).,,29,98,1,9,"Ephemeroptera, Heptageniidae, Stenonema, life history, West Virginia",,0,120,1
"Richmond, Sonya and David C. Lasenby",2006,The behavioural response of mayfly nymphs (^Stenonema^ sp.) to chemical cues from crayfish (^Orconectes rusticus^),Hydrobiologia,,560,335,343,,,0,1180,1
"Richter, Brian D.",1993.,Ecosystem-level conservation at The Nature Conservancy: growing needs for applied research in conservation biology.,,1509,12,197,200,"conservation, biodiversity, The Nature Conservancy",,0,382,1
"Riek, E.F.",1976.,An unusual mayfly (Insecta: Ephemeroptera) from the Triassic of South Africa.,,1225,19,149,151,"fossil, Triassic, Xenophlebioidea, Senophlebia optata",,0,928,0
"Riek, E.F. and J. Kukalova-Peck.",1984.,A new interpretation of dragonfly wing venation based upon Early Upper Carboniferous fossils from Argentina (Insecta: Odonatoidea) and basic character states in pterygote wings.,,873,62,1150,1166,"wing evolution, Carboniferous, fossils, Odonatoidea",,1,762,0
"Robinson, C.T.; G.W. Minshall, and S.R. Rushforth.",1990.,Seasonal colonization dynamics of macroinvertebrates in an Idaho stream.,,1509,9,240,248,"chlorophyll a, colonization, disturbance, diatoms, macroinvertebrates, periphyton, season, stream ecology, Baetis tricaudatus, Epeorus longimanus, deceptivus, Cinygmula mimus, Ephemerella spinifera, Drunella doddsi, Paraleptophlebia heteronea",,0,310,1
"Robotham, Cara D. and Robert T. Allen.",1988.,"^Paraleptophlebia calcarica^, n. sp. (Ephemeroptera: Leptophlebiidae) from Western Arkansas.",,214,61,371,320,"Ephemeroptera, Leptophlebiidae, Paraleptophlebia, new species, Arkansas",,0,199,1
"Rodgers, Elizabeth B.",1982.,Production of ^Caenis^ (Ephemeroptera: Caenidae) in elevated water temperatures.,,1830,1,2,16,"Ephemeroptera, Caenidae, Caenis, production",,0,147,1
"Ross, H.H.",1965.,Pleistocene events and insects.,"H.E. Wright, Jr. and D.G. Frey (eds.). The Quaternary of the United States. Princeton University Press, New Jersey. 922 pp.",,,,,"glaciation, evolution, Pleistocene",,0,364,1
"Ross, H.H.",1972.,The origin of species diversity in ecological communities.,,1891,21,253,259,"ecology, biodiversity, geology",,0,379,1
"Ruffieux, L., J.-M. Elouard and M. Sartori.",1998.,Flightlessness in mayflies and its relevance to hypotheses on the origin of insect flight.,,1559,265,2135,2140,"Flightlessness, brachyptery, evolution, energetics",,1,669,0
"Saettem, Leif M. and John E. Brittain.",1985,"Life cycles and emergence of Ephemeroptera and Plecoptera from Myrkdalsvatn, and oligotrophic lake in Western Norway.",,423,7,229,241,"life cycle, life history, emergence, Ephemeroptera, Plecoptera, Norway",,0,53,1
"Salles, F.F. and C. Molineri.",2006.,"^Amanahyphes saguassu^, a new genus and species of Leptohyphidae (Ephemeroptera: Ephemerelloidea) from northern Brazil.",,423,28,1,12,"Amanahyphes, Leptohyphidae, Brazil",,0,1047,1
"Salles, F.F. and C.R. Lugo-Ortiz.",2002,"A distinctive new species of ^Apobaetis^ (Ephemeroptera: Baetidae) from Mato Grosso and Minas Gerais, Brazil.",,1917,35,1,6,"Brazil, Baetidae, Apobaetis fiuzai",,0,846,1
