Author,Date,Title,Journal,Journal ID,Volume,Page Start,Page End,Keword,Keword2,Reprint,LookupNumber,PDF
"Kluge, N.Y.",1991.,"Cuban mayflies of the family Baetidae (Ephemeroptera) 1. Genera ^Callibaetis^, ^Cloeodes^, and ^Paracloeodes^.",RUSSIAN JOURNAL OF SOME TYPE,0,12,129,135,"Baetidae, Callibaetis, Cloeodes, Paracloeodes, new species, Russia",,0,885,0
"Kluge, N.Y. and J.C.Naranjo",1990.,Mayflies of the family Leptohyphidae (Ephemeroptera) of Cuba,Revue d'Entomologie de I'URSS,0,LXIX`,564,578,"Leptohyphidae, Tricorythodes, Cuba, new species",,0,837,0
Kluge???,1987?,RUSSIAN PAPER,RUSSIAN PAPER,0,4,3,13,"Heptageniidae, Russia, Europe",,0,914,0
Kluge???,1998.,RUSSIAN PAPER,RUSSIAN PAPER,0,1,91,94,"Caenidae, Caenis, Russia",,0,915,0
"Knight, S.S. and C.M. Cooper.",1989.,New records for ^Tortopus incertus^ (Ephemeroptera) in Misssissippi and notes on microhabitat requirements.,,141,100,21,26,"Ephemeroptera, Tortopus incertus, Polymitarcidae, ecology, Mississippi,",,0,722,0
"Kondratieff, B.C. and J.R. Voshell, Jr.",1983.,"A checklist of the mayflies (Ephemeroptera) of Virginia, with a review of pertinent taxonomic literature.",,210,18,273,279,"Ephemeroptera, Virginia, biodiversity",,0,350,1
"Kondratieff, B.C. and J.R. Voshell, Jr.",1981.,Influence of a reservoir with surface release on the life history of the mayfly ^Heterocloeon curiosum^ (McDunnough) (Ephemeroptera: Baetidae).,,873,59,305,314,"Ephemeroptera, Baetidae, Heterocloeon curiosum, life history, life cycle, pollution, reservoir, impoundments",,0,353,1
"Kondratieff, B.C. and J.R. Voshell, Jr.",1981.,Seasonal distribution of mayflies (Ephemeroptera) in two Piedmont rivers in Virginia.,,141,92,189,195,"Virginia, life history, emegence, ecology",,1,629,1
"Kondratieff, B.C. and R.A. Lechleitner.",2002.,"Stoneflies (Plecoptera) of Mount Rainer National Park, Washington.",,1842,62,385,404,"Plecoptera, Washington, Mount Rainier National Park",,0,969,0
"Kondratieff, B.C. and R.S. Durfee.",1994.,A new species of ^Paraleptophlebia^ from Tennessee (Ephemeroptera: Leptophlebiidae).,,141,105,259,261,"Ephemeroptera, Leptophlebiidae, Paraleptophlebia, kirchneri, Tennessee",,1,400,1
"Kondratieff, Boris C. and J. Reese Voshell, Jr.",1980,"Life History and Ecology of ^Stenonema modestum^ (Banks) (Ephemeroptera: Heptageniidae) in Virginia, U.S.A.",,423,2,177,189,"life history, life cycle, ecology, Heptageniidae, Stenonema, mayfly, Ephemeroptera",,0,7,1
"Kondratieff, Boris C. and Steven C. Harris.",1986.,Preliminary checklist of the Mayflies (Ephemeroptera) of Alabama.,,141,97,230,236,"Ephemeroptera, Alabama, Biogeography, checklist",,0,125,1
"Kondratieff, Boris C., Robert E. Zuelling, and David R. Lenat.",2006.,"Description of the adults of ^Maccaffertium lenati^ (Ephemeroptera: Heptageniidae), notes on its ecology and distribution, and a new North Carolina record for ^Isonychia arida^ (Ephemeroptera: INCOMPL",,309,108,995,997,"Maccaffertium lenati, Isonychia arida, new records, North Carolina",,0,1079,0
"Koss, R.W.",1972.,^Baetodes^: New species and new records for North America (Ephemeroptera: Baetidae).,,141,83,93,102,"Ephemeroptera, Baetidae, Baetodes, edmundsi, arizonensis, Arizona, Texas, New Mexico",,1,410,1
"Koss, R.W. and G.F. Edmunds, Jr.",1974.,Ephemeroptera eggs and their contribution to phylogenetic studies of the order.,,1843,55,267,349,"Ephemeroptera, eggs, systematics,",,1,451,0
"Koss, Richard W.",1970.,Ephemeroptera eggs:  Sperm guide morphology and adhesive layer formation.,Trans. Amer. Microsc. Soc.,,89,295,299,"Ephemeroptera, eggs,",,1,563,0
"Koss, Richard W. and G.F. Edmunds, Jr.",1970,A new species of Lachlania from New Mexico with notes on the genus.,,309,72,55,65,"Ephemeroptera, Lachlania, Oligoneuriidae, systematics, new species",,1,171,1
"Krueger, Charles C. and Edwin F. Cook.",1984,"Life cycles, standing stocks, and drift of some Megaloptera, Ephemeroptera, and Diptera from streams in Minnesota, U.S.A..",,423,6,101,108,"life cycle, life history, production, Megaloptera, Ephemeroptera, Diptera, Minnesota",,0,54,1
"Kukalova-Peck, J.",1997.,Arthropod phylogeny and 'basal' morphological structures.,BOOk?,0,,,,"phylogeny, evolution",,1,691,0
"Kukalova-Peck, J.",1971.,The structure of ^Dunbaria^ (Palaeodictyoptera).,,290,78,306,318,"Dunbaria, Palaeodictyoptera, fossil",,1,737,0
"Kukalova-Peck, J.",1985.,"Ephemeroid wing venation based upon new gigantic Carboniferous mayflies and basic morphology, phylogeny, and metamorphosis of pterygote insects (Insecta, Ephemerida).",,873,63,933,955,"Ephemeroptera, fossils, wing venation, Carboniferous mayflies, wing evolution",,1,740,0
"Kukalova-Peck, J.",1983.,Origin of the insect wing and wing articulation from the arthropodan leg.,,873,61,1618,1669,"evolution, wings, articulation, flight",,1,772,0
"Kukalova-Peck, J.",1978.,"Origin and evolution of insect wings and their relation to metamorphosis, as documented by the fossil record.",,216,156,53,126,"evolution, flight, wings, metamorphosis, fossil record",,0,773,0
"Kukalova-Peck, J.",1975.,Megasecoptera from the Lower Permian of Moravia,,290,82,1,19,"evolution, Megasecoptera,",,1,776,0
"Kukalova-Peck, J.",1966.,"Protelytroptera from the Upper Permian of Australia, with a discussion of the Protocoleoptera and Paracoleoptera",,290,73,89,111,"evolution, Protelytroptera, Protocoleoptera, Paracoleoptera, fossils",,1,777,0
"Kukalova-Peck, J.",1968.,Permian mayfly nymphs.,,290,75,310,327,"fossils, evolution, wing evolution, Protereismatidae, Protereisma,",,0,938,0
"Kukalova-Peck, J. and C. Brauckmann.",1990.,"Wing folding in pterygote insects, and the oldest Diaphanopterodea from the early Late Carboniferous of West Germany.",,873,68,1104,1111,"evolution, wing folding,",,1,901,0
"Kukalova-Peck, J. and E.S. Richardson, Jr.",1983.,"New Homoiopteridae (Insecta: Paleodictyoptera) with wing articulation from Upper Carboniferous strata of Mazon Creek, Illinois.",,873,61,1670,1687,"Paleodictyoptera, wing articulation, evolution, Homoiopteridae, Carboniferous",,1,761,0
"Kukalova-Peck, J. and N.D. Sinichenkova.",1992.,"The wing venation and systematics of Lower Permian Diaphanopterodea from the Ural Mountains, Russia (Insecta: Paleoptera).",,873,70,229,235,"Paleoptera, Diaphanopterodea, Lower Permian, Russia, evolution,",,1,797,0
"Kukalova-Peck, J. and R. Willmann.",1990.,"Lower Permian ""mecopteroid-like"" insects from central Europe (Insecta, Endopterygota).",,1912,27,459,468,"Permian, Endopterygota, evolution",,1,801,0
"Kukalova-Peck, J. and S.B. Peck.",1993.,Zoraptera wing structures: evidence for new genera and relationship with the blattoid orders (Insecta: Blattoneoptera).,,367,18,333,350,"Zoraptera, wing evolution, wing venation, blattoid lineage",,1,768,0
"Kukalova, J.",1970.,"Revisional study of the Order Paleodictyoptera in the Upper Carboniferou shales of Commentry, Franc. Part III",,290,77,1,44,"evolution, fossils, Palaeodictyoptera",,1,775,0
"Kukalova, J.",1955.,Archimylacridae handrlirsch (Blattodea) of the Carboniferous of Bohemia.,,1911,1,131,163,"Archimylarcidae, Blattodea, evolution",,1,798,0
"Kukalova, J.",1969.,"Revisional study of the Order Palaeodictyoptera in the Upper Carboniferous Shales of Commentry, France Part II.",,290,76,439,486,"Palaeodictyoptera, Carboniferous, evolution",,1,800,0
"Kukalova, J.",1959.,"^Breyeria barborae^ n. sp. (Insecta, Palaeodictyoptera) of Upper Silesian coal basin (Westphalian).",Vestnik UUG???,0,34,310,314,"Palaeodictyoptera, fossils, evolution",,0,876,0
"Kukalova, J.",1958.,On Czechoslovakian Spilapteridae Handlirsch (Insecta-Paleodictyoptera),Acta Univ. Carolinae,,3??,231,240,"fossils, Palaeodictyoptera, evolution",,0,877,0
"Kukalova, J.",1955,Permoedischia n. g. (Protorthoptera) and Moraviptera n. g. (Palaeodictyoptera) from the Moravian Permian,Czech Publication,0,??,541,574,"fossils, evolution, Protorthoptera, Palaeodictyoptera",,1,878,0
"Kukalova, Jarmila",1958,New ^Palaeodictyoptera^ (Insecta) of the Carboniferous and Permian of Czechoslovakia,,0,,1,13,"fossils, evolution, wings",,1,867,0
"Kukalova, Jarmila",1964.,Permian insects of Moravia. Part II-Liomopteridea,???,0,,39,118,"fossils, evolution",,1,891,0
"Kukaolva-Peck, J.",1992.,"The ""Uniramia"" do not exist: the ground plan of the Pterygota as revealed by Permian Diaphanopterodea from Russia (Insecta: Paleodictyopteroidea).",,873,70,236,255,"Paleodictyopteroidea, evolution, Permian Diaphanopterodea",,0,759,0
"Kukaolva-Peck, J.",1986.,"New Carboniferous Diplura, Monura, and Thysanura, the hexapod ground plan, and the role of thoracic side lobes in the origin of wings (Insecta).",,873,65,2327,2345,"Carboniferous, hexapod ground plan, evolution, origin of wings",,1,760,0
"Kukaolva-Peck, J. and C. Brauckmann.",1992.,Most Paleozoic Protorthoptera are ancestral hemipteroids: major wing braces as clues to a new phylogeny of Neoptera (Insecta).,,873,70,2452,2473,"evolution, Protorthoptera, Neoptera, fossils",,1,758,0
"Kutash, T.N. and D.A. Craig.",1998.,Ontogenetic effects on locomotory gaits in nymphs of ^Baetis tricaudatus^ Dodds (Ephemeroptera: Baetidae).,,1509,17,475,488,"gait, rowing, swimming, hydrodynamics, Reynolds number, behavior, predator avoidance",,1,157,1
"Lager, T.M., M.D. Johnson, and W.P. McCafferty.",1982.,The mayflies of northeastern Minnesota (Ephemeroptera).,,309,84,729,741,"Minnesota, survey, distributions, biodiversity",,0,444,1
"Lager, Thomas M..",1985.,Range extensions and ecological data for Southern United States Ephemeroptera.,,309,87,255,256,"Ephemeroptera, ecology, biogeography, Anepeorus simplex, Arkansas, Baetidae, Baetis ephippiatus, Louisiana, longipalpus, quilleri, Leptohyphes dolani, Florida, Spinadis",,0,123,1
"Landa, V.",1969.,Comparative anatomy of mayfly larvae (Ephemeroptera).,,9,66,289,316,"evolution, comparative anatomy, tracheal system, morphology, phylogeny, classification",,0,724,0
"Landa, V. and T. Soldan.",1983,Ephemeroptera from Mongolia.,,1904,44,189,204,"Mongolia, biodiversity, biogeography",,0,764,0
"Landa, V. and T. Sold醤.",1985.,Phylogeny and higher classification of the order Ephemeroptera: a discussion from the comparative anatomical point of view.,,1882,,1,121,"Phylogeny, higher classification, evolution, comparative anatmony",,1,723,0
"Landa, V., T. Soldan and G.F. Edmunds, Jr.",1982.,Comparative anatomy of larvae of the family Ephemerellidae (Ephemeroptera).,,9,79,241,253,"Ephemerellidae, morphology",,0,673,0
"Landolt, P., M. Dethier, P. Malzacher, and M. Sartori.",1991.,"A new ^Electrogena^ species from Switzerland (Ephemeroptera, Heptageniidae).",Bull. Soc. Vaud. Sc. Nat.,0,80,459,470,"Heptageniidae, Electrogena rivuscellana",,1,711,0
"Lauzon, Michel and P.P. Harper.",1986.,Life history and production of the stream-dwelling mayfly ^Habrophlebia vibrans^ Needham (Ephemeroptera: Leptophlebiidae).,,873,64,2038,2045,"Ephemeroptera, Leptophlebiidae, Habrophlebia, life history, productin",,0,114,0
"Lehmkuhl, D.M.",1979,A new genus and species of Heptageniidae (Ephemeroptera) from Western Canada,,116,111,859,862,"new genus, new species, Heptageniidae, mayfly, Ephemeroptera",,0,5,1
"Lehmkuhl, D.M. and N.H. Anderson",1971,Contributions to the Biology and Taxonomy of the ^Paraleptophlebia^ of Oregon.,,323,47,85,93,"Leptophlebiidae, Paraleptophlebia, life history, life cycle, ecology, biology, taxonomy",,0,238,1
"Lehmkuhl, D.M. and N.H. Anderson .",1970,Observations of the biology of ^Cinygmula reticulata^ McDunnough in Oregon (Ephemeroptera: Heptageniidae).,,323,46,268,274,"Ephemeroptera, Heptageniidae, Cinygmula, observations, Oregon",,0,14,1
"Lehmkuhl, D.M. and N.H. Anderson.",1972.,Microdistribution and density as factors affecting the downstream drift of mayflies.,,132,53,661,667,"Ephemeroptera, drift, ecology, Oregon, Baetis tricaudatus, bicaudatus, parvus, Paraleptophlebia debilis, temporalis, Cinygmula reticulata",,0,295,1
"Lehmkuhl, D.M..",1970,The life cycle of ^Rhithrogena morrisoni^ (Banks) in Western Oregon (Ephemeroptera: Heptageniidae).,,323,46,124,127,"Ephemeroptera, Heptageniidae, Rhithrogena, life cycle, life history",,0,52,1
"Lehmkuhl, D.M..",1968.,Observations on the life histories of four species of ^Epeorus^ in western Oregon.,,323,44,129,137,"Ephemeroptera, Heptageniidae, Epeorus, Life history",,0,117,1
"Lenat, D.R.",1993.,"A biotic index for the southeastern United States: derivation and list of tolerance values, with criteria for assigning water-quality ratings.",,1509,12,279,290,"biotic index, water quality, pollution, biological monitoring, North Carolina",,0,269,1
"Lenat, D.R.",1987.,"The macroinvertebrate fauna of the Little River, North Carolina: Taxa list and seasonal trends.",,1854,110,19,43,"biodiversity, North Carolina, Little River, life cycle, survey",,0,354,0
"Lenat, D.R.",1988.,Water quality assessment of streams using a qualitative collection method for benthic macroinvertebrates.,,1509,7,222,233,"biomonitoring, water quality, pollution",,0,435,1
"Lenat, D.R., D.L. Penrose, and K.W. Eagleson.",1981.,Variable effects of sediment addition on stream benthos.,,1826,79,187,194,"sediment, invertebrates, benthos, stream, pollution",,0,434,1
"Lenat, David R. and David L. Penrose.",1987.,New distribution records for North Carolina Macroinvertebrates.,,141,98,67,73,"Biogeography, biodiversity, North Carolina",,0,131,1
"Lenat, David R..",1983.,"Benthic macroinvertebrates of Cane Creek, North Carolina, and comparsions with other Southeastern Streams.",,1889,9,53,68,"North Carolina, ecology, Cane Creek, biodiversity",,0,135,1
"Leonard, J.W.",1949.,The nymph of ^Ephemerella excrucians^ Walsh,,116,81,158,160,Ephemerella excrucians,,0,923,0
"Lestage, J.-A.",1924.,Notes sur les Eph閙鑢es de la Monographical Revision de Eaton.,,43,64,33,60,"Ephemeridae, Ephemera",,0,919,1
"Lestage, J.-A.",1917.,Contribution ?l'閠ude des larves de Eph閙閞es pal閍rctiques,Annales de Biologie Lacustre,0,8,215,458,NO HARD COPY ONLY PDF,,0,1007,1
"Lestage, J.-A.",1938.,Contribution ?l'閠ude des Eph閙閞opt鑢es. XIX. L'inclusion des Behningeniidae parmi les Oligoneuriidae.,,60,78,315,319,"Behningeniidae, Oligoneuriidae,",,0,1009,1
"Lestage, J.-A.",1945.,Contribution ?l'閠ude des Eph閙閞opt鑢es. XXVI. Etude critique de quelques genres de la faune 閠hiopienne,,60,81,81,89,"Ephemera, Hexagenia, Ephemeridae, Africa, Needhamocoensis, Haplobaetis",,0,1010,1
"Lestage, J.-A.",1942.,Contribution ?l'閠ude des Eph閙閞opt鑢es. XXV. Notes critiques sur les anciens Caenidiens d'Afrique et sur l'ind閜endance de l'関olution Tricorythido-caenidienne.,Bulle du Musee Royal d,0,18,1,20,"Caenidae, Tricorythidae, Africa, evolution",,0,1011,1
"Lestage, J.-A.",1918.,Les Eph閙鑢es d'Afrique (Notes critiques sur les esp鑓es connues),Revue Zoologique Africaine,,6,65,114,"Africa, Ephemeroptera, Tricorythidae, Tricorythus",,0,1014,1
"Lestage, J.-A.",1927.,Une Ephemera nouvelle du Tonkin et tableau des esp鑓es de la faune orientale.,,44,96,93,100,"Ephemeridae, Ephemera",,0,1019,1
"Lestage, J.-A.",1924.,A propos du genre Coenis Steph. = Brachycercus Curt. (Ephemeroptera).,,43,64,61,62,"Caenidae, Coenis, Brachycercus",,0,1020,1
"Lestage, J.-A.",1924.,Atalophlebia brieni sp. nov. 蓀h閙ere nouvelle du Br閟il.,,43,64,21,24,"Ephemeridae, Atalophlebia",,0,1021,1
"Lestage, J.-A.",1931.,Notes sur le premier Brachycercidien d閏ouvert dans la faune australienne Tasmanocoenis tonnoiri sp. nov. (Ephemeroptera) et remarques sur la famille des Brachycercidae Lest.,,259,23,46,60,Brachycercidae,,0,1022,1
"Lestage, J.-A.",1930.,Contribution ?l'閠ude des larves des Eph閙閞opt鑢es. V. Les larves ?trach閛-branchies ventrales.,,259,69,433,440,,,0,1023,1
"Lestage, J.-A.",1924.,Les Eph閙鑢es de l'Afrique du Sud. Catalogue critique & systematique des esp鑓es connues et description de trois genres nouveaux et de sept esp鑓es nouvelles.,Revue Zoologique Africaine,,12,316,352,"Africa, Ephemeroptera",,0,1024,1
"Lestage, J.-A.",1921.,Les Eph閙鑢es indo-chinoises.,,259,61,211,222,"Polyplocia, Polymitarcyidae, Ephemeridae, Potamanthidae",,0,1025,1
"Lestage, J.-A.",1935.,Les composantes australiennes et n閛-z閘andaises du Groupe Siphlonuridien,,60,75,346,358,"Ephemeroptera, Siphlonuridae",,0,1029,1
"Lestage, J.-A.",1930.,Notes sur le genre Massartella nov. gen. de la famille des Leptophlebiidae (Ephemeroptera) et le g閚otype Massartella brieni Lest.,Une Mission Biologique Belge au Br閟il,0,2,249,258,"Leptophlebiidae, Massartella",,0,1031,1
"Lestage, J.-A.",1935.,Contribution ?l'閠ude des Eph閙閞opt鑢es. IX. - Le groupe siphlonuridien.,,60,75,77,139,Siphlonuridae,,0,1032,1
"Lestage, J.-A.",1923.,Etude sur les Palingeniidae (Eph閙鑢es) et description de deux genres nouveaux et d'une esp鑓e nouvelle de la Nouvelle Guin閑.,,43,63,95,112,Ephemeridae,,0,1039,1
"Lestage, J.-A.",1940.,Contribution ?l'閠ude des Eph閙閞opt鑢es. XXIV. Un cas de non-agnathisme chez l'adult de Paleoameletus primitivus Trav. de l'Himalaya.,,43,80,118,124,,,0,1040,1
"Lestage, J.-A.",1922.,Description D'Une Espece Javanaise Nouvelle (Asthenopus corporalli sp. nov.).,Ann. Soc. Entomol. Belg.,,62,142,148,"Polymitarcyidae, Asthenopus, Povilla",PDF,0,1088,1
"Lestage, J.A.",1931.,Contribution ?l'閠ude des larves des Eph閙閞opt鑢es. VII. -Le groupe Potamanthidien.,,259,23,73,146,Potamanthidae,,0,1046,1
"Lestage, J.A.",1938.,Contribution ?l'閠ude des Eph閙閞opt鑢es. XIX. L'inclusion des Behningeniidae parmi les Oligoneuriidae,,60,78,315,319,,,0,1049,1
"Lestage, J.A.",1938.,Contribution ?l'閠ude des 蓀h閙閠opt鑢es. XVI. Recherches critiques sur le complexe am閠ropo-m閠r閠opodidien.,,60,78,155,185,,,0,1050,1
"Lester, G.T., W.P. McCafferty, and M.R. Edmondson.",2002.,New mayfly (Ephemeroptera) records from Idaho.,,141,113,131,136,"new records, Idaho",,1,786,0
"Lewis, P.A.",1974.,Taxonomy and ecology of ^Stenonema^ mayflies.,,1895,,,,"Heptageniidae, Stenonema, Stenacron, taxonomy",,0,265,0
"Lewis, Philip A.",1979,A new species of the mayfly genus ^Stenonema^ Traver from Eastern United States (Ephemeroptera: Heptageniidae),,309,81,321,325,"new species, Heptageniidae, Stenonema, mayflies, Ephemeroptera",,0,3,1
"Lewis, Philip A.",1974,Three new Stenonema species from Eastern North America (Heptageniidae: Ephemeroptera).,,309,76,347,355,"new species, Stenonema, Heptageniidae, mayflies, Ephemeroptera",,0,4,1
"Lewis, Standley E.",1978.,An immature fossil Ephemeroptera (Ephemeridae) from the Ruby River Basin (Oligocene) of southwestern Montana.,,15,71,479,480,"Oligocene, Ephemeridae, fossil",,1,987,0
"Lewis, Steven P.",1986,Records of ^Baetisca obesa^ (Say) (Ephemeroptera: Baetiscidae) in Southeast Texas and Southwest Louisiana.,,1827,31,396,398,"Ephemeroptera, Baetiscidae, Baetisca, Texas, Louiniana, records, biogeography",,0,61,1
"Liechti, P.M.",1982.,Five additional Ephemeroptera genera from Kansas.,,1878,12,13,16,"Ephemeroptera, Baetidae, Apobaetis, Dactylobaetis, Heptageniidae, Anepeorus, Ephemerellidae, Ephemerella, Eurylophella, Kansas",,0,461,1
"Liechti, P.M.",1980.,Baetis mayfly records for Kansas.,,1878,9,15,19,"Ephemeroptera, Baetidae, Baetis dardanus, ephippiatus, flavistriga, intercalaris, longipalpus, propinquus, pygmaeus, quilleri, Kansas",,0,462,1
"Liechti, Paul M.",1979.,^Caenis^ mayfly records for Kansas.,,1878,8,12,14,"Ephemeroptera, Caenidae, Caenis, Kansas",,0,472,1
"Liechti, Paul M.",1978.,^Stenonema^ mayfly records for Kansas.,,1878,6,53,58,"Ephemeroptera, Heptageniidae, Stenonema, Kansas",,0,473,1
"Liechti, Paul M.",1981.,"Kansas mayfly records for the genera Potamanthus, Pentagenia, Ephemera, Ephoron, and Tortopus.",,1878,10,52,56,"Ephemeroptera, Potamanthus, Pentagenia, Ephemera, Ephoron, Tortopus, Kansas",,0,474,1
"Long, L.S. and B.C. Kondratieff.",199?.,"The Mayflies (Ephemeroptera) of Tennessee, with a review of the possibly threatened species occurring within the stae.",,175,29,29,182,"Tennessee,",,1,557,0
"Lowen, Robert G. and John F. Flannagan",1992.,Nymphs and imagoes of four North American species of ^Procloeon^ Bengtsson with description of a new species (Ephemeroptera: Baetidae)*,,116,124,97,108,"Ephemeroptera, Baetidae, Procloeon",,1,237,1
"Lubini, V. and M. Sartori.",1994.,"Current status, distribution, life cycle and ecology of ^Rhithrogena germanica^ Eaton, 1885 in Switerland: preliminary results (Ephemeroptera, Heptageniidae).",,1844,56,388,397,"Heptageniidae, Rhithrogena germanica, life cycle, ecology",,1,710,0
"Lugo-Ortiz, C.R. and F.C. de Moor.",2000.,^Pseudocloeon aquacidum^: A new subjective synonym of ^P. latum^ (Ephemeroptera: Baetiae).,,141,111,380,381,"Baetidae, Africa, Pseudocloeon aquacidum, latum",,0,243,1
"Lugo-Ortiz, C.R. and W.P. McCafferty.",1993.,Genera of Baetidae (Ephemeroptera) from Central America.,,141,104,193,197,"Central America, Baetidae, Acerpenna, Baetis,",,0,245,1
"Lugo-Ortiz, C.R. and W.P. McCafferty.",1994.,New records of Ephemeroptera from Mexico.,,141,105,17,26,"Mexico, new records",,0,260,1
"Lugo-Ortiz, C.R. and W.P. McCafferty.",1994.,^Farrodes^ (Ephemeroptera: Leptophlebiidae) in the Antilles: New species from Puerto Rico and review of the genus.,,141,105,263,266,"Puerto Rico, Ephemeroptera, Farrodes, taino, grenadae, hyalinus, Ephemeroptera, Leptophlebiidae,",,1,399,1
"Lugo-Ortiz, C.R. and W.P. McCafferty.",1995.,"^Guajirolus nanus^ (Ephemeroptera: Baetidae), a new species from Costa Rica.",,141,106,68,70,"Ephemeroptera, Baetidae, Guajirolus nannus, ektrapeloglossa, Costa Rica",,1,441,1
"Lugo-Ortiz, C.R. and W.P. McCafferty.",1995.,"New species, stage description, and records of ^Baetodes^ (Ephemeroptera: Baetidae) from Mexico and Central America.",,141,106,81,86,"Ephemeroptera, Baetidae, Baetodes, Mexico, Central America, Baetodes deludens, deficiens, fuscipes, longus, noventus, tritus, Coasta Rica.",,0,442,1
"Lugo-Ortiz, C.R. and W.P. Mccafferty.",1994.,"The mayfly genus Acerpenna (Insecta, Ephemeroptera, Baetidae) in Latin America.",,1395,29,65,74,"Ephemeroptera, Baetidae, Acerpenna, naranjoi, boriquensis, intermedia, pletura, robacki, Americabaetis, Latin America, Mexico, Costa Rica, Cuba",,1,454,1
"Lugo-Ortiz, C.R. and W.P. McCafferty.",1995.,Contribution to the Taxonomy of the Leptohyphidae (Insecta: Ephemeroptera) of Central America.,,1395,30,165,176,"Ephemeroptera, Leptohyphidae, Leptohyphes, Tricorythodes, Haplohyphes, Costa Rica, Belize",,0,489,1
"Lugo-Ortiz, C.R. and W.P. McCafferty.",1996.,Contribution to the Taxonomy of ^Callibaetis^ (Ephemeroptera: Baetidae) in Southwestern North America and Middle America.,,423,18,1,9,"Ephemeroptera, Baetidae, Callibaetis, Mexico",,0,497,1
"Lugo-Ortiz, C.R. and W.P. McCafferty.",1996.,New species of Leptophlebiidae (Ephemeroptera) from Mexico and Central America.,,1871,32,3,18,"Ephemeroptera, Leptophlebiidae, Choroterpes, Thraulodes, Farrodes, Hagenulopsis, Traverella",,1,499,1
"Lugo-Ortiz, C.R. and W.P. McCafferty.",1996.,"Phylogeny and classification of the ^Baetodes^ complex (Ephemeroptera: Baetidae), with description of a new genus.",,1509,15,367,380,"Ephemeroptera, Baetidae, Baetodes, Moribaetis, Mayobaetis, Prebaetodes, Central America, Mexico, Ecuador, Colombia",,0,500,1
"Lugo-Ortiz, C.R. and W.P. McCafferty.",1996.,^Aturbina georgei^ gen. et sp. n.: A small minnow mayfly (Ephemeroptera: Baetidae) without turbinate eyes.,,423,18,175,183,"Ephemeroptera, Baetidae, Aturbina, South America",,0,512,1
"Lugo-Ortiz, C.R. and W.P. McCafferty.",1995.,"Three distinctive new genera of Baetidae (Insecta, Ephemeroptera) from South America.",,1871,31,233,243,"Ephemeroptera, Baetidae, Adebrotus, Tomedontus, Waltzoyphius, South America,",,1,513,1
"Lugo-Ortiz, C.R. and W.P. McCafferty.",1996.,Central American ^Tortopus^ (Ephemeroptera: Polymitarcyidae):  A unique new species and new country records.,,141,107,23,27,"Polymitarcyidae, Tortopus, Central America",,0,514,1
"Lugo-Ortiz, C.R. and W.P. McCafferty.",1997.,First adult description of the unusual baetid mayfly genus ^Echinobaetis^ (Ephemeroptera: Baetidae).,,141,108,113,116,"Baetidae, Echinobaetis, Sulawesi",,0,520,1
"Lugo-Ortiz, C.R. and W.P. McCafferty.",1996.,New Central American and Mexican records of Ephemeroptera species.,,141,107,303,310,"Ephemeroptera, Mexico, Baetidae, Caenidae, Ephemeridae, Heptageniidae, Isonychiidae, Leptohyphidae, Leptophlebiidae, Polymitarcyidae, Siphlonuridae",,0,528,1
"Lugo-Ortiz, C.R. and W.P. McCafferty.",1995.,Annotated inventory of the mayflies of Arizona.,,141,106,131,140,"Arizona,",,1,531,1
"Lugo-Ortiz, C.R. and W.P. McCafferty.",1995.,Taxonomy of the North and Central American species of ^Camelobaetidius^ (Ephemeroptera: Baetidae).,,141,106,178,192,"Camelobaetidius, Baetidae, North America, Central America",,1,532,1
"Lugo-Ortiz, C.R. and W.P. McCafferty.",1996.,The ^Bugilliesia^ complex of African Baetidae (Ephemeroptera).,,376,122,175,197,"Baetidae, Bugilliesia, Africa",,0,533,1
"Lugo-Ortiz, C.R. and W.P. McCafferty.",1996.,The genus ^Paracloeodes^ (Insecta: Ephemeroptera: Baetidae) and its presence in South America.,,1871,32,161,169,"Baetidae, Paracloeodes, South America, Brazil, Paraguay, Argentina",,0,537,1
"Lugo-Ortiz, C.R. and W.P. McCafferty.",1997.,^Edmulmeatus grandis^: and extraordinary new genus and species of Baetidae (Insecta: Ephemeroptera) from Madagascar.,,1871,33,191,195,"Baetidae, Edmulmeatus, Madagascar, Africa",,1,538,0
"Lugo-Ortiz, C.R. and W.P. McCafferty.",1996.,^Crassabwa^: a new genus of small minnow mayflies (Ephemeroptera: Baetidae) from Africa.,,1871,32,235,240,"Baetidae, Crassabwa, Africa",,1,539,1
"Lugo-Ortiz, C.R. and W.P. McCafferty.",1996.,"The composition of ^Dabulamanzia^, a new genus of Afrotropical Baetidae (Ephmeroptera), with descriptions of two new species.",,102,132,7,13,"Baetidae, Dabulamanzia, Africa",,0,540,1
"Lugo-Ortiz, C.R. and W.P. McCafferty.",1998.,First report and new species of the genus ^Cloeodes^ (Ephemeroptera: Baetidae) from Australia.,,141,109,122,128,"Australia, Baetidae, Cloeodes, fustipalpus, illiesi, biogeography",,0,546,0
