Author,Date,Title,Journal,Journal ID,Volume,Page Start,Page End,Keword,Keword2,Reprint,LookupNumber,PDF
"[A]villa, S. and R.W. Flowers.",2006.,Adult stages of two species of ^Traverella^ (Ephemeroptera: Leptophlebiidae) from Costa Rica.,,141,117,395,398,"Leptophlebiidae, holzenthali, promifrons, Costa Rica",PDF,0,1104,1
"[A]villa, Socorro, and R. Wills Flowers.",2006.,Two new species of ^Choroterpes^ Eaton (Ephemeroptera: Leptophlebiidae) from Costa Rica.,,1917,1245,59,68,"Costa Rica, Choroterpes, new species",PDF,0,1064,1
Al-Zubaidi F; Braasch D; Al-Kayatt A,1987.,Mayflies from Iraq (Insecta: Ephemeroptera),Faunistische Abhandlungen Staatliches Museum f黵 Tierkunde Dresden,0,14,179,184,Iraq,,0,1017,0
"Alba-Tercedor, J.",2002.,"A new synonym in ^Baetis: Baetis nexus^ Navas, 1918 is the valid name of ^Baetis pentaphlebodes^ Ujhelyi, 1966 (Ephemeroptera: Baetidae).",,423,24,77,79,"Baetidae, Baetis pentaphlebodes, nexus",,0,945,0
"Alba-Tercedor, J. and C. Zamora-Munoz.",1993.,"^Caenis nachoi^ sp.n., with keys for the identification of the European species of the ^Caenis macrura^ group (Ephemeroptera: Caenidae).",,423,15,239,247,"Ephemeroptera, Caenidae, systematics, taxonomy, Europe, spain, Caenis, nachoi, luctuosa, martae.",,0,417,1
"Alba-Tercedor, J. and J. Flannagan.",1995,"Two new Canadian species of the genus ^Tricorythodes^ Ulmer, with additional studies on other North American species (Insecta, Ephemeroptera: Leptohyphidae).",,873,73,1588,1598,"Ephemeroptera, Leptohyphidae, Tricorythodes mosequs, cobbi, Canada, Manitoba, systematics, stygiatus, atratus, periius",,1,13,1
"Alba-Tercedor, J. and P. Malzacher.",1986.,A new synonym in the genus ^Caenis^ Stephens 1835 (Ephemeroptera: Caenidae).,,423,8,55,58,"Ephemeroptera, Caenidae, Caenis",,0,104,1
"Alba-Tercedor, J. and R. Sowa",1987,"New representatives of the ^Rhitheogena diaphana^-group from Continental Europe, with a redescription of ^R. diaphana^ Navas, 1917 (Ephemeroptera: Heptageniidae)",,423,9,65,83,"Ephemeroptera, Heptageniidae, Rhitheogena, mayfly, Europe",,0,8,1
"Alba-Tercedor, J. and W.L. Peters.",1985.,"Types and additional specimens of Ephemeroptera studied by Longinos Navas in the Museo de Zoologia del Ayuntamiento, Barcelona, Span.",,423,7,215,227,"types, Spain, Navas",,1,600,0
"Alba-Tercedor, J. and W.P. McCafferty.",2000.,"^Acentrella feropagus^, new species (Ephemeroptera: Baetidae): formal new name for North American ^A. lapponica^ sensu Morihara and McCafferty.",,141,111,137,139,"Baetidae, Acentrella feropagus",,0,781,0
"Alba-Tercedor, Javier and Majida El Alami.",1999.,Description of the nymphs and eggs of ^Acentrella almohades^ sp. N. from Morocco and southern Spain (Ephemeroptera: Baetidae).,,423,21,241,247,"Baetidae, Acentrella, Morocco, Spain",,0,935,0
"Alba-Tercedor, Javier and Tomas Derka.",2003.,"^Torleya nazarita^ sp. n., a new species from southern Spain (Ephemeroptera: Ephemerellidae).",,423,25,23,32,"Ephemerellidae, Spain, Torleya nazarita",,0,940,0
"Alba-Tercedor, Javier.",1998.,"Description of the imagines of ^Rhithrogena goeldini^ Sartori and Sowa, 1988, and keys for the identification of imagines of the European species of the ^R. diaphana^-subgroup (Ephemeroptera: Heptagen",,423,20,125,130,"Rhithrogena, Heptageniidae, Europe",,0,931,0
"Alba-Tercedor, Javier.",2000.,"^Habrophlebia antoninoi^ sp. n., a new species from Spain, with an account of the European species ^Habrophlebia^ Eaton, 1881 (Ephemeroptera: Leptophlebiidae, Habrophlebiinae).",,423,22,1,7,"Habrophlebia, Leptophlebiidae, Spain",,0,934,0
"Ali, S. Rashid.",1970.,Certain mayflies (Order:  Ephemeroptera) of West Pakistan.,Pakistan Journal of Science,,22,119,124,"Ephemeroptera, Pakistan,",,0,998,1
"Ali, S. Rashid.",1971.,Certain mayfly nymphs (Order; Ephemeroptera) of Azad Kashmir and Swat.,Pakistan Journal of Science,0,23,209,214,"Ephemeroptera, Pakistan,",,0,999,1
"Allan, J.D. and A.S. Flecker.",1993.,Biodiversity conservation in running waters.,,1845,43,32,43,"biodiversity, ecology, conservation, ethics, rivers, river ecosystems,",,0,290,1
"Allan, J.D. and B.P. Feifarek.",1989.,Distances travelled by drifting mayfly nymphs: factors influencing return to the substrate.,,1509,8,322,330,"drift, ecology, Ephemeroptera, Baetis, Dinygmula",,0,322,1
"Allen, R.K.",1973,Generic revisions of mayfly nymphs. 1. ^Traverella^ in North and Central America (Leptophlebiidae).,,15,66,1287,1295,"Ephemeroptera, Leptophlebiidae, Traverella, North America, Central America, systematics",,0,18,1
"Allen, R.K.",1965,The adult stages of ^Ephemerella^ (^drunella^) ^pelosa^ Mayo.,,323,41,280,282,"Ephemeroptera, Ephemerellidae, Ephemerella, Drunella pelosa",,0,31,1
"Allen, R.K.",1968,New species and records of ^Ephemerella^ (^Ephemerella^) in Western North America.,,214,,,,"New species, records, Ephemeroptera, Ephemerellidae, Ephemerella,",,0,32,1
"Allen, R.K.",1973,New Ephemerellidae from Madagascar and Afghanistan.,,323,49,160,164,"New species, Ephemeroptera, Ephemerellidae, Madagascar, Afghanistan, Manohyphella",,0,33,1
"Allen, R.K.",1968,A new species of ^Ephemerella^ (^Serratella^) from Califorina (Ephemeroptera: Ephemerellidae).,,323,44,122,124,"new species, Ephemeroptera, Ephemerella sequoia",,0,34,1
"Allen, R.K.",1967,New species of new world Leptohyphinae (Ephemeroptera: Tricorythidae).,,116,99,350,374,"Tricorythidae, new species, Leptohyphes, Leptohyphidae",,1,43,1
"Allen, R.K.",1978,The nymphs of North and Central American ^Leptohyphes^ (Ephemeroptera: Tricorythidae).,,15,71,537,558,"Ephemeroptera, Tricorythidae, Leptohyphes, nymphs, systematics, keys, North America, Central America",,1,46,1
"Allen, R.K.",1985.,"Mexican Mayflies: new species, descriptions and records (Ephemeroptera).",,323,61,332,333,"new records, new species, Mexico",,1,64,1
"Allen, R.K.",1986.,Mayflies of Vietnam: ^Acerella^ and ^Drunella^ (Ephemeroptera: Ephemerellidae).,,323,62,301,302,"Ephemeroptera, Ephemerellidae, Acerella, Drunella",,1,106,1
"Allen, R.K.",1984.,A new classification of the subfamily Ephemerellinae and the description of anew genus.,,323,60,245,247,"Ephemeroptera, Ephemerellidae, systematics",,0,138,0
"Allen, R.K.",1977.,A new species of ^Tricorythodes^ with notes (Ephemeroptera: Tricorythidae).,,214,50,431,435,"Ephemeroptera, Tricorythidae, Tricorythodes, new species, taxonomy, systematics",,0,184,1
"Allen, R.K.",1974.,"^Neochoroterpes^, a new subgenus of ^Choroterpes^ Eaton from North America (Ephemeroptera: Leptophlebiidae).",,116,106,161,168,"Leptophlebiidae, Choroterpes, Neochoroterpes, Choroterpes mexicanus, Choroterpes crocatus, Choroterpes kossi",,0,232,1
"Allen, R.K.",1966.,New species of ^Heptagenia^ from Western North America (Ephemeroptera: Heptageniidae).,,116,98,80,82,"Heptageniidae, Heptagenia, new species",,0,263,1
"Allen, R.K.",1959.,A new species of ^Ephemerella^ from Oregon (Ephemeroptera: Ephemerellidae).,,214,32,59,60,"Ephemerellidae, Ephemerella edmundsi, Oregon",,1,446,1
"Allen, R.K.",1973.,New species of ^Leptohyphes^ Eaton.,,323,49,363,372,"Leptohyphidae, Leptohyphes, new species",,1,726,0
"Allen, R.K.",1975.,^Ephemerella^ (^Cincticostella^): A revision of the nymphal stage.,,323,51,16,22,"Ephemerellidae, Cincticostella",,1,728,0
"Allen, R.K.",1966,"^Haplohyphes^, a new genus of Leptohyphinae (Ephemeroptera: Tricorythidae)",,214,39,565,568,"Leptohyphidae, Haplohyphes, Peru",,0,839,0
"Allen, R.K.",1968.,New species and records of ^Ephemerella^ (^Ephemerella^) in Western North America.,,214,41,557,567,Ephemerella,,1,1013,0
"Allen, R.K. and C.M. Murvosh.",1987,Mayflies (Ephemeroptera: Tricorythidae) of the Southwestern United States and Northern Mexico.,,15,80,35,40,"Ephemeroptera, Tricorythidae, systematics, keys,",,0,47,1
"Allen, R.K. and C.M. Murvosh.",1987.,"New Baetidae from the southwestern United States and Northern Mexico (Ephemeroptera, Insecta), with notes.",,116,119,1095,1099,"Ephemeroptera, Baetidae, biogeography, distributions, Baetis, Baetodes, Dactylobaetis, Mexico",,1,195,0
"Allen, R.K. and C.M. Murvosh.",1987.,Leptophlebiidae of the Southwestern United States and Northwestern Mexico (Insecta: Ephemeroptera).,,609,47,283,286,"Ephemeroptera, Leptophlebiidae, Choroterpes, Paraleptophlebiidae, Thraulodes, Traverella, distribution, new records, Mexico.",,0,201,1
"Allen, R.K. and C.M. Murvosh.",1983.,Taxonomy and zoogeography of the mayflies (Ephemeroptera: Insecta) of Baja California.,,15,,,,"Ephemeroptera, Baetidae, Baetis, caelestis, byblis, Callibaetis, Incertae, Dactylobaetis, navis, Iron, Heptageniidae, Leptophlebiidae, Choroterpes, Thraulodes, Serratella, Drunella, Tricorythodes, Caenis, bajaensis, Mexico",,1,316,0
"Allen, R.K. and C.M. Murvosh.",1991.,A biogeographically based assessment of the potential mayfly fauna of Nevada.,,323,67,206,215,"Ephemeroptera, Nevada, biogeography,",,1,317,1
"Allen, R.K. and E.S.M. Chao.",1972,A new species of ^Baetodes^ from Arizona (Ephemeroptera: Baetidae).,,94,71,1?,52?,"Ephemeroptera, Baetidae, Baetodes, new species",,0,22,1
"Allen, R.K. and E.S.M. Chao.",1978.,Mayflies of the Southwest: New species and records of Heptageniidae.,,323,54,311,315,"Heptageniidae, Rhithrogena, Arizona, New Mexico, new species",,1,261,1
"Allen, R.K. and E.S.M. Chao.",1981.,Mayflies of the southwest: New records and notes of Siphlonuridae (Ephemeroptera).,,323,57,449,456,"Siphlonuridae, Ameletus, Siphlonurus, new records, Arizona, New Mexico",,1,730,0
"Allen, R.K. and E.S.M. Chao.",1978.,Mayflies of the Southwest: New species and records of ^Dactylobaetis^.,,323,54,300,304,"Dactylobaetis, new species, new records, navis",,1,731,0
"Allen, R.K. and G.F. Edmunds, Jr.",1959,A revision of the genus ^Ephemerella^ (Ephemeroptera: Ephemerellidae) I. The subgenus ^Timpanoga^.,,116,91,51,58,"Ephemeroptera, Ephemerellidae, Timpanoga, taxonomy, hecuba",,0,172,1
"Allen, R.K. and G.F. Edmunds, Jr.",1961,A revision of the Genus ^Ephemerella^ (Ephemeroptera: Ephemerellidae) II. The subgenus ^Caudatella^,,15,54,603,612,"Ephemeroptera, Ephemerellidae, Caudatella, taxonomy",,0,173,1
"Allen, R.K. and G.F. Edmunds, Jr.",1961,A revision of the genus ^Ephemerella^ (Ephemeroptera: Ephemerellidae) III. The subgenus ^Attenuatella^.,,214,34,161,173,"Ephemeroptera, Ephemerellidae, Attenuatella, taxonomy",,0,175,1
"Allen, R.K. and G.F. Edmunds, Jr.",1962,A revision of the geus ^Ephemerella^ (Ephemeroptera: Ephemerellidae) IV. The subgenus ^Dannella^.,,214,35,333,338,"Ephemeroptera, Ephemerellidae, Dannella, taxonomy",,0,176,1
"Allen, R.K. and G.F. Edmunds, Jr.",1962,A revision of the genus ^Ephemerella^ (Ephemeroptera: Ephemerellidae) V. The subgenus ^Drunella^ in North America.,,252,3,147,179,"Ephemeroptera, Ephemerellidae, Drunella, taxonomy",,0,178,1
"Allen, R.K. and G.F. Edmunds, Jr.",1963.,A revision of the genus ^Ephemerella^ (Ephemeroptera: Ephemerellidae) VI. The subgenus ^Serratella^ in North America.,,15,56,583,600,"Ephemeroptera, Ephemerellidae, Serratella, taxonomy",,0,179,1
"Allen, R.K. and G.F. Edmunds, Jr.",1963,A revision of the genus ^Ephemerella^ (Ephemeroptera: Ephemerellidae) VII. The subgenus ^Eurylophella^.,,116,95,597,623,"Ephemeroptera, Ephemerellidae, Eurylophella, taxonomy",,0,180,1
"Allen, R.K. and G.F. Edmunds, Jr.",1965,"A revision of the genus ^Ephemerella^ (Ephemeroptera, Ephemerellidae) VIII. The subgenus ^Ephemerella^ in North America.",,252,4,243,282,"Ephemeroptera, Ephemerellidae, Ephemerella, taxonomy",,0,181,1
"Allen, R.K. and G.F. Edmunds, Jr.",1976.,^Hyrtanella^: A new genus of Ephemerellidae from Malaysia (Ephemeroptera).,,323,52,133,137,"Ephemerellidae, Malaysia, Hyrtanella christinaea",,1,450,1
"Allen, R.K. and G.F. Edmunds, Jr.",1956.,A list of the mayflies of Oregon.,,1840,33,85,87,"Ephemeroptera, Oregon",,0,456,1
"Allen, R.K. and G.F. Edmunds, Jr.",1963.,"New and little known Ephemerellidae from southern Asia, Africa and Madagascar (Ephemeroptera).",,312,5,11,22,"Ephemeroptera, Asia, Africa, Madagascar, Ephemerellina, Ephemerella, Ephemerellidae, Eurylophella",,1,463,0
"Allen, R.K. and G.F. Edmunds, Jr..",1976,A revision of the genus ^Ametropus^ in North America (Ephemeroptera: Ametropididae).,,214,49,625,635,"Ephemeroptera, Ametropididae, Ametropus, revision, genus",,0,45,1
"Allen, R.K. and R.C. Brusca.",1973,New species of Leptohyphinae from Mexico and Central America (Ephemeroptera: Tricorythidae).,,116,105,83,95,"Ephemeroptera, Tricorythidae, new species, Mexico, Central America",,0,42,1
"Allen, R.K. and R.C. Brusca.",1978.,Generic revisions of Mayfly nymphs II. ^Thraulodes in North and Central America (Leptophlebiidae).,,116,110,413,433,"Ephemeroptera, Leptophlebiidae, Thraulodes, systematics",,0,124,1
"Allen, R.K. and S.D. Cohen.",1977.,"Mayflies (Ephemeroptera) of Mexico and Central America: new species, descriptions, and records.",,116,109,399,414,"Heptageniidae, Mexico, Central America",,0,748,1
"Allen, R.K. and S.S. Roback.",1969.,New species and records of new world Leptohyphinae.,,214,42,372,379,"Ephemeroptera, Tricorythidae, Leptohyphes, spinosus, hirsutus, echinatus, myllonotus, Tricorythodes ocellus, Leptohyphes maculatus, maculatus, setosus, tuberculatus, dolani, robacki, Central America",,1,197,1
"Allen, R.T.",1990.,Insect endemism in the Interior Highlands of North America.,,165,73,539,569,"Ephemeroptera, endemism, Interior Highlands, biogeography",,0,321,1
"Allen, Richard K.",1977,A Review of ^Ephemerella (Dannella)^ and the Description of a New Species (Ephemeroptera: Ephemerellidae),The Pan-Pacific Entomologist,,53,215,217,,,0,1186,1
"Anderson, H.M.",1993.,Conserving America's freshwater ecosystems: The Wilderness Society's approach.,,1509,12,194,196,"biodiversity, conservation, Wilderness Society, streams, ecosystems",,0,381,1
"Argyle, D.W. and G.F. Edmunds, Jr.",1962.,"Mayflies (Ephemeroptera) of teh Curecanti reservoir basins Gunnison River, Colorado.","University of Utah, Anthropological Papers, No. 59, Upper Colorado Series, No. 8.",,,,,"Colorado, Gunnison River, reservoir, pollution, Ameletus, Siphlonurus, Baetis, Pseudocloeon, Centroptilum, Heptagenia, Cinygmula, Rithrogena, Epeorus, Ephemerella, Tricorythodes, Paraleptophlebia",,1,467,1
"Arvy, L. and W.L. Peters.",1976.,"Liste des Ephemeropteres-hostes de parasites, de commensaux et autres associes.",,1887,51,121,141,"Ephemeroptera, parasites",,1,645,0
"Avila, Socorro and R. Willis Flowers.",2005.,New species and records of ^Ulmeritoides^ (Ephemeroptera: Leptophlebiidae) from Costa Rica.,,1917,1010,1,14,"Leptophlebiidae, Ulmeritoides, Costa Rica, new species",,0,977,1
"Bae, Y.J. and W.P. McCafferty.",1998,Phylogenetic systematics and biogeography of the Neoephemeridae (Ephemeroptera: Pannota),,423,20,35,68,"Pannota, biogeography, systematics, Neoephemeridae",,1,926,1
"Bae, Y.J., K.J. Finlay, and I.C. Campbell.",2004.,Taxonomic status of the Australian mayfly genera ^Jappa^ and ^Ulmerophlebia^ (Ephemeroptera: Leptophlebiidae),,141,115,1,10,"Leptophlebiidae, Jappa, Ulmerophlebia, Australia",,0,950,1
"Bae, Y.J., Kluge, N.J., and D.J. Chun.",1998.,New synonym and new data on the distribution of mayflies from Korea and the Russian Far East (Ephemeroptera).,,1684,7,89,94,"Ephemeroptera, Korea, Russia, synonym",,0,739,0
"Ball, S.L., P.D.N. Herbert, S.K. Burian, and J.M. Webb.",2005.,Biological identifications of mayflies (Ephemeroptera) using DNA barcodes.,,1509,24,508,524,"DNA, bar codes, taxonomy, molecular",,0,989,1
"Ball, Shelley L.",2002.,"Population variation and ecological correlates of tychoparthenogenesis in the mayfly, ^Stenonema femoratum^.",Biological Journal of the Linnean Society,,75,101,123,"population variation, dispersal, parthenogenesis, Stenonema femoratum",PDF,0,1083,1
"Ban, R. and T. Kawai.",1986.,Comparison of the life cyles of two mayfly species between upper and lower parts of the same stream.,,423,8,207,215,"Ephemeroptera, Ephemerellidae, life cycles",,0,76,1
"Banks, N.",????.,Descriptions of new Neuropteroid insects.,,85,?,?,?,"Heptageniidae, Hagenulus eatoni, Rhithogena hespera, Epeorus morrisoni, undulatus, Baetidae, Baetis lasallei, parallela, Cloeon carolina",,0,236,1
"Banks, N.",1863?.,Descriptions of new neuropteroid insects.,,85,12,421,455,"Ephemeroptera, new species, Hagenulus eatoni, Rhithogena hespera, Epeorus morrisoni, undulatus, Baetis lasallei, parallela, Cloeon carolina",,0,293,1
"Banks, N.",1913,Neuropteroid insects from Brazil,,290,,83,89,"Brazil, Ephemeridae, Campsurus, Spaniophelbia, Tricorythus australis, Baetis",,0,842,0
"Banks, N.",1903.,Neuropteroid insects from Arizona.,,309,5,237,245,"Ephemeroptera, Arizona",,0,1054,1
"Barber-James, H.M. and W.P. McCafferty.",1997.,Review and new species of the African genus ^Acanthiops^ (Ephemeroptera: Baetidae).,,1871,33,85,92,"Baetidae, Acanthiops, Africa",,1,536,0
"Barnard, K.H.",1932.,South African may-flies (Ephemeroptea).,,387,20,201,259,"South Africa, new species",,1,874,0
"Barnard, K.H.",1940.,"Additional records, and descriptions of new species, of South African Alder-flies (Megaloptera), may-flies (Ephemeroptera), caddis-flies (Trichoptera), stone-flies (Perlaria), and dragon-flies (Odon##",,41,32 (Part 6),609,661,"South Africa, Ephemeroptea, new species",,0,1041,1
"Baumann, R.W. and B.C. Kondratieff.",2000.,"A confirmed record of the Ephemeroptera genus ^Baetisca^ from west of the Continental Divide and an annotated list of the mayflies of the Humboldt River, Nevada.",,1842,60,459,461,"Baetisca, Nevada, Humboldt River",,1,690,0
"Baumgardner, D.E.",2003.,New synonyms and stage description for three species of Leptohyphidae (Ephemeroptera).,,309,105,203,208,"Leptohyphidae, Leptohyphidae, Allenhyphes, Vacupernius, Homoleptohyphes",,1,835,1
"Baumgardner, D.E.",2009.,"^Tricorythodes minutus^ Traver, a new synonym of ^Tricorythodes explicatus"" Eaton (Ephemeroptera: Leptohyphidae).
^Tricorythodes minutus^ Traver, a new synonym of ^Tricorythodes explicatus^ Eaton (Ephemeroptera: Leptohyphidae).",,309,111,57,67,"Leptohyphidae, Tricorythodes minutus, explicatus",PDF,0,862,1
"Baumgardner, D.E.",2005.,"New and additional records of mayflies (Ephemeroptera) from the southwestern United States, including a new country record.",,309,107,977,978,"Arizona, New Mexico, Texas, new records",,0,985,0
"Baumgardner, D.E.",2007.,New species of Leptohyphidae (Ephemeroptera) from Costa Rica.,,309,109,416,426,"Leptohyphidae, Leptohyphes, Tricorythodes, Costa Rica",PDF,0,1092,1
"Baumgardner, D.E. and D.E. Bowles.",2005.,Preliminary surveyof the mayflies (Ephemeroptera) and caddisflies (Trichoptera) of Big Bend Ranch State Park and Big Bend National Park.,Journal of Insect Science,0,5:28,,,"Ephemeroptera, Trichoptera, Big Bend, survey",,0,991,1
"Baumgardner, D.E. and N.A. Wiersema.",1999.,Additions to the inventory of Texas mayflies (Ephemeroptera).,,141,110,70,71,"Ephemeroptera, Texas",,1,603,1
"Baumgardner, D.E. and S. Avila.",2006,"^Cabecar serratus^, a new genus and species of leptohyphid mayfly from Central America, and description of the imaginal stages of ^Tricorythodes sordidus^ Allen (Ephemeroptera: Leptohyphidae).",,1917,1187,47,59,"Cabecar serratus, Tricorythodes sordidus, Costa Rica",,0,1057,1
"Baumgardner, D.E. and W.P. McCafferty.",2000.,^Leptohyphes zalope^ (Ephemeroptera: Leptohyphidae): a polytypic North and Central American species.,,141,111,49,59,"Leptohyphidae, Leptohyphes",,1,654,0
"Baumgardner, D.E. and W.P. McCafferty.",2010.,Revision of the genus ^Leptohyphes^ Eaton (Ephemeroptera: Leptohyphidae) in North and Central America.,,1917,2360,1,33,"Leptohyphidae, Leptohyphes, Central America, North America",PDF,0,1125,1
"Baumgardner, D.E., J.H. Kennedy, and B.C. Henry.",1997.,New and additional records of Texas mayflies (Insecta: Ephemeroptera).,,376,123,55,69,"Texas, Baetidae, Caenidae, Ephemerellidae, Ephemeridae, Isonychiidae, Leptohyphidae, Leptophlebiidae, Polymitarcyidae",PDF,0,523,1
"Baumgardner, D.E., M.D. Meyer, and W.P. McCafferty.",2006.,A new species of Asioplax (Ephemeroptera: Leptohyphidae) from Costa Rica and Nicaragua.,,323,82,346,350,"Costa Rica, Nicaragua, Leptohyphidae, Asioplax, new species, Tricorythodes",PDF,0,1093,1
"Baumgardner, D.E., S.K. Burian, and D. Bass.",2003.,"Life stage descriptions, taxonomic notes, and new records for the mayfly family Leptohyphidae (Ephemeroptera).",,1917,332,1,12,"Leptohyphidae, Tricorythodes, Asioplax, Leptohyphes, Allenhyphes",,1,836,1
"Bednarik, A.F. and W.P. McCafferty.",1979.,Biosystematic revision of the genus ^Stenonema^ (Ephemeroptera: Heptageniidae).,Can. Bull. Fish. Aquat. Sci.,,201,1,73,"Ephemeroptera, Heptageniidae, Stenonema, systematics, taxonomy",,0,431,0
"Bednarik, Andrew F. and G.F. Edmunds, Jr.",1980.,Descriptions of larval ^Heptagenia^ from the Rocky Mountain region (Ephemeroptera: Heptageniidae).,,323,56,51,62,"Ephemeroptera, Heptageniidae, Heptagenia, systematics, taxonomy",,1,188,1
"Belfiore, C.",1994.,"Taxonomic characters for species identification in the genus ^Electrogena^ Zurwerra and Tomka, with a description of ^Electrogena hyblaea^ sp. n. from Sicily (Ephemeroptera, Heptageniidae).",,423,16,193,199,"Ephemeroptera, Heptageniidae, Electrogena hyblaea, Sicily, taxonomy, systematics",,0,420,1
"Belfiore, C. and M. Sartori.",1999,"Redescription of ^Electrogena galilaea (Demoulin, 1973) (Ephemeroptera, Heptageniidae).",,356,106,1025,1034,"Heptageniidae, Electrogena galilae, taxonomy, Lebanon, Israel",,1,719,0
"Belfiore, Carlo",1983,,,0,,1,112,"Italy, biodiversity, mayflies, Ephemeroptera",,1,884,0
"Belfiore, Carlo.",1986.,"Contribution to the knowledge of the Heptageniidae of Greece, with a description of ^Ecdyonurus moreae^ sp. n. (Ephemeroptera).",,423,8,191,195,"Ephemeroptera, Heptageniidae, Ecdyonurus, new species, Greece",,0,95,1
"Benke, A.C.",1990.,A perspective on America's vanishing streams.,,1509,9,77,88,"stream, river, dam, stream conservation, stream exploitation, Wild and Scenic Rivers, National Rivers",,0,288,1
"Benke, A.C. and D.I. Jacobi.",1986.,Growth rates of mayflies in a subtropical river and their implications for secondary production.,,1509,5,107,114,"Ephemeroptera, life history, production, stream ecology",,0,80,1
"Benke, A.C. and J.B. Wallace.",1980.,Trophic basis of production among net-spinning caddisflies in a southern Appalachian stream.,,132,61,108,118,"Trichoptera, production, life history, production, food habits, Hydropsychidae, Philopotamidae, spiralling",,0,268,1
"Benton, M.J. and G. Pritchard.",1988.,New methods for mayfly instar number determination and growth curve estimation.,,1614,4,361,367,"production, life history, life cycle, instars",,0,335,1
"Bergman, E.A. and W.L. Hilsenhoff.",1978.,^Baetis^ (Ephemeroptera: Baetidae) of Wisconsin.,,175,11,125,135,"Ephemeroptera, Baetidae, Baetis brunneicolor, frondalis, Diphetor hageni, intercalaris, levitans, Acerpenna macdunnoughi, phoebus, propinquus, pygmaeus, spinosus, vagans, life cycle, ecology, Wisconsin",,1,298,1
"Bergman, E.A. and W.L. Hilsenhoff.",1978.,Parthenogenesis in the mayfly genus ^Baetis^ (Ephemeroptera: Baetidae).,,15,71,167,168,"Ephemeroptera, Baetis, parthenogenesis",,1,468,1
"Bergman, E.A. and W.L. Hilsenhoff.",1978.,"Description of the nymph of ^Centroptilum walshi^ (Ephemeroptera: Baetidae), with biological notes.",,175,11,81,84,"Ephemeroptera, Baetidae, Centroptilum walshi",,0,470,0
"Berner, L.",1956.,The genus ^Neoephemera^ in North America (Ephemeroptera: Neoephemeridae).,,15,49,33,42,"Ephemeroptera, Neoephemeridae, Neoephemera, systematics, taxonomy",,0,253,1
"Berner, L.",1946.,New species of Florida mayflies (Ephemeroptera).,,165,28,60,82,"Leptophlebiidae, Habrophlebiodes brunneipennis, Choroterpes hubbelli, Ephemerellidae, Ephemerella, Leptohyphidae, Tricorythodes, Caenidae, Brachycercus, Baetiae, Pseudocloeon, Centroptilum",,0,270,1
"Berner, L.",1977.,Distributional patterns of southeastern mayflies (Ephemeroptera).,,1847,22,1,55,"Southeastern United States, distributions, biodiversity",,1,332,0
"Berner, L.",1949.,A report on two mayfly gynandromorphs.,,165,32,105,109,"Baetidae, gynandromorph",,1,590,0
"Berner, L.",1953.,New mayfly records from Florida and a description of a new species.,,165,34,145,149,"Florida, Neoephemera youngi",,1,591,0
"Berner, L.",1983.,The mayfly ^Siphlonurus phyllis^ McDunnough (Ephemeroptera: Siphlonuridae): its discovery in Minnesota.,,309,85,665,669,"Minnesota, Siphlonuridae, Siphlonurus",,1,593,0
"Berner, L.",????,II. Ephemeroptera Nymphs,Altiplano Aquatic Insects [part of book?],0,,187,194,"Peru, Baetidae, Leptophlebiidae, Leptohyphidae",,1,875,0
"Berner, L. and R.K. Allen.",1961.,Southeastern species of the mayfly subgenus ^Serratella^ (^Ephemerella^: Ephemerellidae),,165,44,149,158,"Ephemerellidae, Ephemerella, Serratella, Ecology, Biology",,0,239,1
"Berner, L. and R.K. Allen.",1961.,Southeastern species of the mayfly subgenus ^Serratella^ (^Ephemerella^: Ephemerellidae),,165,44,149,158,"Ephemerellidae, Ephemerella, Serratella, Ecology, Biology",,0,259,1
"Berner, Lewis.",1978.,A review of the mayfly family Metretopodidae.,,376,104,91,137,"Ephemeroptera, Metretopodidae, systematics, Siphloplecton, Metretopus, speciosum, fuscum, costalense, interlineatum, brunneum, simile, basalealter, borealis",,0,87,0
"Berner, Lewis.",1975.,The mayfly family Leptophlebiidae in the Southeastern United States.,,165,58,137,153,"Ephemeroptera, Leptophlebiidae, Choroterpes, Habrophlebia, Habrophlebiodes, Leptophlebia, Paraleptophlebia, distributions",,1,202,1
"Berry, E.W.",????,New or hitherto unknown ephemerid nymphs of the Eastern United States.,,88,47,25,31,"Habrophlebia americana, Blasturus cupidus, Callibaetis ferruginea,",,0,223,1
"Blair, W. Frank.",1950.?,The biotic provinces of Texas.,,1791,2,93,117,"Texas, geology, biotic provinces",,0,524,1
"Bowles, D.E. and T.L. Arsuffi.",1993.,"Karst aquatic ecosystems of the Edwards Plateau region of central Texas, USA: a consideration of their importance, threats to their existence, and efforts for their conservation.",,1894,3,317,329,"Texas, conservation, biodiversity",,0,525,0
