Author,Date,Title,Journal,Journal ID,Volume,Page Start,Page End,Keword,Keword2,Reprint,LookupNumber,PDF
"Edmunds, G.F., Jr.",1982.,Historical and life history factors in the biogeography of mayflies.,,1855,22,371,374,"biogeography, cladistic",,1,649,1
"Edmunds, G.F., Jr. and R.K. Allen.",1964.,The Rocky Mountain species of ^Epeorus^ (^Iron^) Eaton (Ephemeroptera: Heptageniidae).,,214,37,275,288,"Ephemeroptera, Heptageniidae, Epeorus, Iron, taxonomy, systematics",,0,189,1
"Edmunds, G.F., Jr. and R.K. Allen.",1957.,A checklist of the Ephemeroptera of North America North of Mexico.,,15,50,317,324,"taxonomy, North America, Ephemeroptera, checklist",,0,951,0
"Edmunds, G.F., Jr. and W.P. McCafferty.",1978.,A new J.G. Needham device for collecting adult mayflies (and other out-of-reach insects).,,141,89,193,194,"Ephemeroptera, methods",,1,477,1
"Edmunds, G.F., Jr., and J.R. Traver.",1959.,The classification of the Ephemeroptera I. Ephemeroidea: Behningiidae.,,15,52,43,51,"Ephemeroptera, Behningiidae, Behningia, Dolania",,1,395,0
"Edmunds, G.F., Jr., and J.R. Traver.",1954.,An outline of a reclassification of the Ephemeroptera.,,309,56,236,240,"Ephemeroptera, systematics, classification",,1,396,0
"Edmunds, G.F., Jr., and J.R. Traver.",1954.,"The flight mechanics and evolution of the wings of Ephemeroptera, with notes on the archetype insect wing.",,223,44,390,400,"flight mechanics, evolution",,1,894,0
"Edmunds, G.F., Jr., and Jay R. Traver.",1954.,"Entomology.-The flight mechanics and evolution of the wings of Ephemeroptera, with notes on the archetype insect wing.",,223,44,390,400,"evolution, ecology, flight, phylogeny",,1,496,1
"Edmunds, G.F., Jr., and R.W. Koss.",1972.,A review of the Acanthametropodinae with a description of a new genus (Ephemeroptera: Siphlonuridae).,,323,48,136,144,"Siphlonuridae, Acanthametropodinae, Analetris eximia, Wyoming, Utah",,1,447,1
"Edmunds, G.F., Jr., and S.L jensen.",1974.,A new genus and subfamily of North Ameican Heptageniidae (Ephemeroptera).,,309,76,495,497,"Heptageniidae, Spinadis wallacei, Georgia, Wisconsin, Indiana, Spinadinae,",,1,445,1
"Edmunds, G.F., Jr., and W.P. McCafferty.",1996.,New field observations on burrowing in Ephemeroptera from around the world.,,141,107,68,76,"Ephemeroptera, Leptophlebiidae, Potamanthiidae, Polymitarcyidae, Ephemeridae, ecology, behavior, burrowing",,0,486,1
"Edmunds, G.F., Jr., L.T. Nielsen, and J.R. Larsen.",1956.,The life history of ^Ephoron album^ (Say) (Ephemeroptera: Polymitarcidae).,,1460,14,145,153,"Polymitarcidae, Ephoron, Ephoron album, life history, ecology, biology, life cycle",,0,220,1
"Edmunds, G.F., Jr., Lewis Berner, and Jay R. Traver.",1958.,North American mayflies of the family Oligoneuriidae.,,15,51,375,382,"Ephemeroptera, Oligoneuriidae, Homoeoneuria, Lachlania",,0,480,1
"Edmunds, G.F., Jr., R.K. Allen, and W.L. Peters.",1963.,An annotated key to the nymphs of the families and subfamilies of mayflies (Ephemeroptera).,,1839,13,1,55,"Ephemeroptera, systematics",,1,455,0
"Edmunds, Jr., G.F. and W.P. McCafferty.",1984.,^Ephemera compar^: an obscure Colorado burrowing mayfly (Ephemeroptera: Ephemeridae).,,141,95,186,188,"Ephemeroptera, Ephemeridae, Ephemera, Colorado",,0,109,1
"Edsall, T.A., A. Manny, D.W. Schloesser, S.J. Nichols, and A.M. Frank.",1991.,Production of ^Hexagenia limbata^ nymphs in contaminated sediments in the Upper Great Lakes connecting channels.,,1826,219,353,361,"Ephemeroptera, Ephemeridae, Hexagenia limbata, Great Lakes, production, contaminated sediments, pollution",,0,356,1
"Edwards, Wm. H.",1882,"Description of New Species of Diurnal Lepidoptera Taken by Mr. H. K. Morrison, At Fort Grant and In Graham Mountains, Aziona, 1882",Papilio,,2,136,143,"Morrison Collections, New Mexico, Texas, Arizona, Graham Mountains",,0,1140,0
"Elouard, J.-M., R. Oliarinony and M. Sartori.",1998.,"Aquatic biodiversity of Madagascar. 9. The genus Eatonica Navas (Ephemeroptera, Ephemeridae).",Bulletin de la Societe Entomologique Suisse,,71,1,9,"Ephemeridae, Eatonica, Madagascar",,1,668,0
"Elouard, J.M. and M.T. Gillies.",1989,West African Ephemeroptera. The genus ^Machadorythus^ (Tricorythidae).,,423,11,1,10,"Ephemeroptera, Tricorythidae, West Africa, Africa, Machadorythus",,0,41,1
"Elouard, Jean-Marc, M.T. Gillies, J. Wuillot.",1990.,Ephemeroptera from West Africa: The genus ^Pseudopannota^ (Baetidae).,,1884,23,27,39,"Ephemeroptera, Baetidae, Psudopannota, Africa, ecology, taxonomy, systematics",,0,92,1
"Emmerich, Daniel",2004.,Primer reporte de ^Vacupernius^ Wiersema and McCafferty 2000 (Ephemeroptera: Leptohyphidae) para America del Sur.,,1868,19,?,?,"Leptohyphidae, Vacupernius, Colombia",,0,997,0
"Emmerich, Daniel E.",2007.,Two new species of ^Tricorythodes^ Ulmer (Ephemeroptera: Leptohyphidae) from Colombia.,,1917,1561,63,68,"Leptohyphidae, Tricorythodes, Colombia, new species",,0,1116,0
"Emmerich, Daniel E.",2007.,Two new species of ^Tricorythodes^ Ulmer (Ephemeroptera: Leptohyphidae) from Colombia.,,1917,1561,63,68,"Colombia, Leptohyphidae, Tricorythodes, uniandinus, capuccinorum",PDF,0,1135,1
"Epler, J.H.",1986.,"A novel new Neotropical ^Nanocladius^ (Diptera: Chironomidae), symphoretic on ^Traverella^ (Ephemeroptera: Leptophlebiidae).",,165,69,319,327,"Traverella, Leptophlebiidae, ecology, biology, Nanocladius, Chironomidae",,1,602,1
"Erwin, T.L.",1982.,Tropical forests: Their richness in Coleoptera and other arthropod species.,,1630,36,74,75,"conservation, biodiversity",,0,377,1
"Evans, J.L., W.F. Botts, Jr., and R.W. Flowers.",1985,A new ^Heptagenia^ (Ephemeroptera: Heptageniidae) from the Susquehanna and Delaware Rivers from Eastern North America.,,15,78,5,7,"Heptageniidae, Ephemeroptera, Heptagenia, new species",,1,62,1
"Evenhuis, N.L.",2007.,"Helping solve the ""other"" taxonomic impediment:  Completing the ^Eight steps to total enlightment and taxonomic nirvana^.",,1917,1407,3,12,"taxonomy, biodivesity, phylogeny",PDF,0,1103,1
"Fager, E.W.",1969.,Production of stream benthos: A critique of the method of assessment proposed by Hynes and Coleman (1968).,,1831,14,766,770,"production, ecology, life history, life cycle",,0,333,1
"Faulkner, G.M. and D.C. Tarter.",1977.,"Mayflies, or Ephemeroptera, of West Virginia with emphasis on the nymphal stage.",,141,88,202,206,"West Virginia, biodiversity, mayflies, Siphlonuridae, Baetidae, Heptageniidae, Leptophlebiidae, Ephemerellidae, Tricorythidae, Caenidae, Neophemeridae, Baetiscidae, Potamanthidae, Ephemeridae, Polymitarcyidae",,0,725,0
"Fiance, S.B.",1978.,Effects of pH on the biology and distribution of ^Ephemerella funeralis^ (Ephemeroptera).,,757,31,332,339,"Ephemeroptera, Ephemerellidae, Ephemerella funeralis, ecology, pH, life cycle",,0,291,1
"Fink, T.J.",1984.,"Errors in instar determination of mayflies (Ephemeroptera) and stoneflies (Plecoptera) using the simple frequency, Janetschek, Cassie and Dyar's law methods.",,666,14,347,365,"life history, life cycle, ecology",,1,612,1
"Fisher, Janice E. and Donald C. Tarter.",1988.,Records of Nymphal ^Stenonema^ (Ephemeroptera: Heptageniidae) from West Virginia.,,141,99,30,32,"Ephemeroptera, Heptageniidae, Stenonema, West Virginia, Biogeography, ecology",,0,130,1
"Flannagan, John F. and G.H. Lawler.",1972.,"Emergence of caddisflies (Trichoptera) and mayflies (Ephemeroptera) from Heming Lake, Manitoba.",,116,104,173,183,"emergence, Ephemeroptera, Heming Lake Manitoba, Canada, life history, life cycle",,1,70,0
"Flecker, Alexander S. and J. David Allan.",1988.,"Flight direction in some Rocky Mountain mayflies (Ephemeroptera), with observations of parasitism.",,423,10,33,41,"Ephemeroptera, ecology",,0,160,1
"Flory, E.A. and A.M. Milner.",2000.,"Macroinvertebrate community succession in Wolf Point Creek, Glacier Bay National Park, Alaska.",Freshwater Biology,0,44,465,480,"ecology, community succession, Alaska",,0,967,1
"Flowers, R. Willis and Eduardo Dominguez.",1992.,New genus of Leptophlebiidae (Ephemeroptera) from Central and South America.,,15,85,655,661,"Ephemeroptera, Leptophlebiidae, Traverella, Hydrosmilodon, taxonomy",,1,198,1
"Flowers, R. Willis.",2007,Una perscpectiva latinoamericana de la biogeografia,Biogeografia,,1,15,16,"Latin America, Biogeography",,0,1143,0
"Flowers, R. Wills and Catherine M. Pringle",1995,Yearly fluctuations in the mayfly community of a tropical stream draining lowland pasture in Costa Rica,,,,131,150,,,0,1187,1
"Flowers, R. Wills and Socorro [A]vila",2006.,"Biogeographical and ecological notes on the genus ^Tikuna^ Savage, Flowers, and Porras (Ephemeroptera: Leptophlebiidae) from Central and South America.",,141,117,133,138,"Costa Rica, biogeography, Tikuna, Leptophlebiidae",,0,1058,0
"Flowers, R. Wills and W.L. Hilsenhoff.",1975,Heptageniidae (Ephemeroptera) of Wisconsin.,,175,8,201,218,"Ephemeroptera, Heptageniidae, Wisconsin, state records",,0,12,1
"Flowers, R.W.",1978,Occurrence of ^Cloeon cognatum^ Stephens in the United States (Ephemeroptera: Baetidae).,,141,89,79,80,"Ephemeroptera, Baetidae, Cloeon, new record",,1,24,1
"Flowers, R.W.",1987,The adult stage of three Central American ^Baetodes^ (Ephemeroptera: Baetidae) with notes on the genus.,,423,9,1,10,"Ephemeroptera, Baetidae, Baetodes, Central America, new description",,0,25,1
"Flowers, R.W.",1980,Two new genera of Neartic Heptageniidae (Ephemeroptera).,,165,63,296,307,"new genera, Heptageniidae, Ephemeroptera, systematics, Heptagenia, Leucrocuta, Nixe",,0,59,1
"Flowers, R.W.",1982.,Review of the genus ^Macdunnoa^ (Ephemeroptera: Heptageniidae) with description of a new species from Florida.,,175,15,25,30,"Ephemeroptera, Heptageniidae, Macdunnoa, systematics",,1,85,1
"Flowers, R.W.",1986.,Holarctic distributions of three taxa of Heptageniidae (Ephemeroptera).,,141,97,193,197,"Ephemeroptera, Heptageniidae, systematics",,1,126,1
"Flowers, R.W.",1987.,New species and life stages of ^Atopophlebia^ (Ephemeroptera: Leptophlebiidae: Atalophlebiinae).,,423,9,203,209,"Ephemeroptera, Leptophlebiidae, Atopophlebia, South America, taxonomy",,1,208,0
"Flowers, R.W.",1993.,"Endangered invertebrates, and how to worry about them.",,1890,94,25,31,"invertebrates, conservation, extinction",,0,422,1
"Flowers, R.W.",1991.,Diversity of stream-living insects in northwestern Panama.,,1509,10,322,334,"Panama, Ephemeroptera, ecology, biology",,1,606,1
"Flowers, R.W.",1979.,A new species of ^Baetis^ from Panama (Ephemeroptera: Baetidae).,,323,55,187,191,"Baetidae, Baetis, Panama",,1,620,1
"Flowers, R.W.",1980.,"^Atopophlebia fortunensis^, a new genus and species from Panama (Leptophlebiidae: Ephemeroptera).",,165,63,162,165,"Leptophlebiidae, Atopophlebia fortunensis, new genus, Panama",,0,949,0
"Flowers, R.W.",1985.,"^Guajirolus^, a new genus of Neotropical Baetidae (Ephemeroptera).",,1049,20,27,31,"Baetidae, Guajirolus, Panama, Colombia",,0,1065,1
"Flowers, R.W. and Manuel L. Pescador.",1984.,A new ^Afronurus^ (Ephemeroptera: Heptageniidae) from the Philippines.,,1823,26,362,365,"Ephemeroptera, Heptageniidae, Philippines, Afronurus",,0,141,1
"Flowers, R.W. and W.L Peters.",1981.?,^Stenonema mexicana^ (Heptageniidae: Ephemeroptera) in Southern Central America.,,141,92,152,154,"Heptageniidae, Stenonema, Panama",,1,559,1
"Flowers, R.W. and W.L. Hilsenhoff.",1978.,Life cycles and habitats of Wisconsin Heptageniidae (Ephemeroptera).,,1826,60,159,171,"Heptageniidae, life cycles, life history, ecology, emergence, Heptageniidae",,1,299,1
Fonseca,,,,,,,,,,0,,0
"Fonseca, J. J. L. and F. de A. Esteves",1999,"Influence of Bauxite Tailings on the Structure of the Benthic Macroinvertebrate Community in an Amazonian Lake (Lago Batata, Para - Brazil)",Rev. Brasil. Biol,,59,397,405,,,0,1188,1
"Fonseca, Joao Jose Leal and Francisco de Assis Esteves",2000,"Life cycle and production of ^Campsurus notatus^ (Ephemeroptera, Polymitarcyidae) in an Amazonian lake impacted by bauxite tailings (Para, Brazil)",Hydrobiologia,,437,91,99,,,0,1189,1
"Forbes, S.A.",???,The lake as a microcosm.,,1895,,,,"conservation, ethics,",,0,376,1
"Forrester, Graham E.",1994,Influences of Predatory Fish on the Drift Dispersal and Local Density of Stream Insects,Ecology,,75,1208,1218,,,0,1190,1
"Fremling, Calvin R.",1960,"Biology of a large mayfly, ^Hexagenia bilineata^ (Say) of the Upper Mississippi River.",,,,842,852,"Ephemeroptera, Ephemeridae, Hexagenia bilineata, life cycle, life history, biology, emergence",,0,182,1
"Frost, S.W.",1967.,"Mayflies taken at the Archbold biological station, Highlands County, Florida.",,165,50,281,284,"Ephemeroptera, Florida, emergence, Caenis diminuta, Caenidae, Baetidae, Callibaetis pretiosus, Heptageniidae, Stenonema interpunctatum, Callibaetis floridanus, Centroptilum viridocularis, Hexagenia orlando",,0,320,1
"Funk, D.H. and B.W. Sweeney.",1994.,The larvae of Eastern North American ^Eurylophella^ (Ephemeroptera: Ephemerellidae).,,376,120,209,286,"Ephemeroptera, Ephemerellidae, Eurylophella, systematics, genetics, poconoensis, enoensis, macdunnoughi,",,1,401,0
"Funk, David H., Sweeney, Bernard W., Jackson, John K.",2010,Why stream Mayflies can reproduce without males but remain bisexual: a case of lost genetic variation,J.N. Am. Benthol. Soc.,,29,1258,1266,,,0,1167,0
"Gaino, E., M. Mazzini, and M. Sartori.",1993.,"Comparative analysis of the chorionic pattern in ^Habroleptoiodes^ species (Ephemeroptera, Leptophlebiidae).",Boll. Zool.,0,60,155,162,"egg shell morphology, ootaxonomy, scanning electron microscopy, Habroleptoides",,1,709,0
"Gaino, Elda and Carlo Belfiore.",1987,"On the type specimens of ^Electrogena zebrata^ (Hagen, 1864) and ^E. fallax^ (Hagen, 1864) (Ephemeroptera).",,423,9,109,114,"Ephemeroptera, Baetidae, systematics, Electrogena",,0,21,1
"Gattolliat, J.-L.",2003,The genera ^Demoulinia^ Gillies and ^Potamocloeon^ Gillies (Ephemeroptera: Baetidae) in Madagascar,,1917,184,1,18,"Madagascar, Demoulinia, Potamocloeon, Baetidae",,0,847,1
"Gattolliat, J.-L.",2001.,^Rheoptilum^: A new genus of two-tailed baetidae (Ephemeroptera) from Madagascar.,,423,23,67,81,"Baetidae, Rheoptilum, Madagascar",,0,899,0
"Gattolliat, J.-L. and M. Sartori.",1999.,A new species of ^Afrobaetodes^ (Ephemeroptera: Baetidae) and first report of this genus from Madagascar.,,1871,35,179,184,"Afrobaetodes, Baetidae, Madagascar",,1,663,0
"Gattolliat, J.-L. and M. Sartori.",2000.,^Guloptiloides^: an estraordinary new carnivorous genus of Baetidae (Ephemeroptera).,,423,22,148,159,"Baetidae, Guloptiloides, Madagascar",,1,794,0
"Gattolliat, Jean-Luc",2004,A distinctive new species of ^Xyrodromeus^ Lugo-Ortiz and McCafferty (Ephemeroptera: Baetidae) from Madagascar.,,1917,452,1,10,"Baetidae, Xyrodromeus, Madagascar",,0,871,1
"Gattolliat, Jean-Luc and Luke M. Jacobus.",2005.,Review of the ^Dabulamanzia^ and ^Nesydemius^ (Ephemeroptera: Baetidae) species of Madagascar.,,217,113,212,217,"Madagascar, Dabulamanzia, Nesydemius, Baetidae",,0,1053,1
"Gattolliat, Jean-Luc, and Michel Sartori.",2008,"What is ^Baetis rhodani^ (Pictet, 1843) (Insecta, Ephemeropter, Baetidae)? Designation of a neotype and redescription of the species from its original area",,1917,1957,69,80,"Baetidae, Switzerland, Baetis rhodani",PDF,0,1149,1
"Gattolliat, Jean-Luc, Samatha J. Hughes, Michael T. Monoghan and Michel Sartori.",2008,"Revision of Madeiran mayflies (Insecta, Ephemeroptera)",,1917,1957,52,68,"Maderia, Cloeon peregrinator, Baetis enigmaticus, DNA, molecular",PDF,0,1148,1
"Gibberson, D.J. and T.D. Galloway.",1985.,"Life history and production of ^Ephoron album^ (Say) (Ephemeroptera: Polymitarcidae) in the Valley River, Manitoba.",,873,63,1668,1674,"Ephemeroptera, Polymitarcidae, Ephoron, life history, life cycle",,0,151,1
"Gibbs, H.L., K.E. Gibbs, M. Siebenmann, L. Collins.",1998.,Genetic differentiation among populations of the rare mayfly ^Siphlonisca aerodromia^ Needham.,,1509,17,464,474,"genetic structure, parthoenogenesis, Siphlonisca, molecular",,0,686,0
"Gibbs, K. Elizabeth and Marcia Siebenmann.",1996.,Life history attributes of the rare mayfly ^Siphloniscia aerodromia^ Needham (Ephemeroptera: Siphlonuridae).,,1509,15,95,105,"Ephemeroptera, Siphlonuridae, Siphlonisca, life history, ecology, life cycle, Maine",,0,493,1
"Gibbs, K. Elizabeth and Terry M. Mingo.",1986.,"The life history, nymphal growth rates, and feeding habits of ^Siphlonisca aerodromia^ Needham (Ephemeroptera: Siphlonuridae) in Maine.",,873,64,427,430,"Ephemeroptera, Siphlonuridae, Siphlonisca, Maine, life history, life cycle, ecology",,0,152,1
"Gibbs, K. Elizabeth.",1977,Evidence for obligatory parthenogenesis and its possible effect on the emergence period of ^Cleon triangulifer^ (Ephemeroptera: Baetidae).,,116,109,337,340,"Ephemeroptera, Baetidae, Cloeon, parthenogenesis",,0,26,1
"Giberson, Donna J. and David M. Rosenberg.",1992.,"Egg development in ^Hexagenia limbata (Ephemeroptera: Ephemeridae) from Southern Indian Lake, Manitoba: temperature effects and diapause.",,1509,11,194,203,"Ephemeroptera, Ephemeridae,Hexagenia, ecology",,0,149,1
"Giberson, Donna J. and David M. Rosenberg.",1992.,"Effects of temperature, food quantity, and nymphal rearing density on life-history traits of a northern population of ^Hexagenia^ (Ephemeroptera: Ephemeridae).",,1509,11,181,193,"Ephemeroptera, Ephemeridae, Hexagenia, life history, ecology",,0,150,1
"Gillies, M.T.",1985,A preliminary account of the East African species of ^Cleon^ Leach and ^Rhithrocloeon^ gen. n. (Ephemeroptera).,,423,7,1,17,"Ephemeroptera, Baetidae, Cloeon, Rhithrocloeon, new genus, East Africa, Africa",,0,48,1
"Gillies, M.T.",1990.,"A revision of the African species of ^Centroptilum^ Eaton (Baetidae, Ephemeroptera).",,423,12,97,128,"Ephemeroptera, Baetidae, Centroptilum, Africa, revision, systematics",,0,159,0
"Gillies, M.T.",1994.,"Descriptions of some Afrotropical Baetide (Ephemeroptera) II. ^Baetis^ Leach, s.l., East African species.",,423,16,105,118,"Ephemeroptera, Baetidae, Africa, systematics, taxonomy, Baetis, mtonis, spatulatus, tripunctatus, monikae,",,0,414,1
"Gillies, M.T.",1993.,"Descriptions of some Afrotropical Baetidae (Ephemeroptera) II. ^Baetis^ Leach, s.l., West African species.",,423,15,213,223,"Ephemeroptera, Baetidae, systamatics, taxonomy, Africa, Baetis, boussoulius, elouardi, gambiae,",,0,415,1
"Gillies, M.T.",1954.,"The Adult Stages of ^Prosopistoma^ Latreille (Ephemeroptera), with Descriptions of Two New Species from Africa.",,386,105,355,372,"Prosopistomatidae, Prosopistoma, Africa, Asia",,1,459,0
"Gillies, M.T.",1980.,"An introduction to the study of ^Cloeon^ Leach (Baetidae, Ephemeroptera) in West Africa.",Bulletin de I'I.F.A.N. 42:135-156.(?????),,,,,"Ephemeroptera, Baetidae, Cloeon, Africa, systematics",,1,460,0
"Gillies, M.T.",1974.,Three new species of ^Elassoneuria^ (Ephemeroptera: Oligoneuriidae) from tropical Africa.,J? Ent.,0,43,73,82,"Ephemeroptera, Oligoneuriidae, Elassoneuria, South Africa",,1,829,0
"Gillies, M.T.",1999.,"Reinstatement of ^Afroptiloides^ as a genus (Baetidae, Ephemeroptera).",,423,3,197,203,"Baetidae, Afroptiloides, Africa, Acanthiops",,0,946,0
"Gillies, M.T.",1960.,A new genus of Tricorythide (Ephemeroptera) from East Africa.,,326,29,35,40,"Tricorythidae, Ephemerythus, Africa",,0,1012,0
"Gillies, M.T.",1957.,New records of species of ^Euthraulus^ Barnard (Ephemeroptera) from east Africa and Oriental region.,,326,26,43,48,"Africa, Oriental, Euthraulus, Leptophlebiidae",,0,1026,1
"Gillies, M.T.",1951.,Further notes on Ephemeroptera from India and South East Asia.,Proceedings of the Royal Entomological Society of London (B),,20,121,130,"Polymitarcyidae, India, Asia",PDF,0,1090,1
"Gillies, M.T., J.M. Elouard, J. Wuillot.",1990.,Ephemeroptera from West Africa: the genus ^Ophelmatostoma^ (Baetidae).,,1884,23,115,120,"Ephemeroptera, Baetidae, Ophelmatostoma, Africa,",,1,457,1
"Gledhill, T.",1959.,"The life-history of ^Ameletus inopinatus^ (Siphlonuridae, Ephemeroptera).",,1826,14,85,89,"life history, Ameletus, ecology",,1,870,0
"Goncalves, Ines C., Da-Silva, Elidiomar R., Nessimian, Jorge L.",2010,"First Record and new species of Tortopsis Molineri, 2010 (Ephemeroptera, Polymitarcyidae) from Brazil",Zootaxa,,2866,50,54,"Tortopsis canum, Brazil, Polymitarcyidae",,0,1163,1
"Goncalves, Ines C., Da-Silva, Elidiomar R., Nessimian, Jorge L.",1920?,"Two new species of Tricorythodes Ulmer, 1920 (Insecta, Ephemeroptera) from Southeastern Brazil",Zootaxa,,2721,62,68,"Tricorythidae, Brazil, Tricorythodes diasae, chalaza",,0,1165,1
"Goncalves, Ines C., Elidiomar R. Da-Silva, and Jorge L. Nessimian",2011,^Oligoneuria macabaiba^ sp. nov. (Insecta: Ephemeroptera) from Brazil,Rev. Biol. Trop.,,59,1,5,,,0,1183,1
"Gonz[a]lez-Lazo, D. and F.F. Salles.",2007.,"Description of a new species of ^Fallceon^ from Cuba, and redescription of the larva of ^F. longifolius^ (Ephemeroptera, Baetidae).",,1917,1583,51,57,"Baetidae, Fallceon grandis, longifolius",PDF,0,1130,1
"Gonzales, J.M., A. Basaguren, and Jesus Pozo.",2003.,Life history and production of ^Epeorus torrentium^ Eaton (Ephemeroptera: Heptageniidae) in a North Iberian stream.,,423,25,247,258,"life history, production, Epeorus torrentium, Heptageniidae, Spain",,0,939,0
"Gordon, E.L.",1933.,Notes on the Ephemerid genus ^Leptophlebia^.,,63,28,116,134,"Ephemeridae, Leptophlebiidae, Paraleptophlebia, moerens, debilis, mollis, guttata, johnsoni, volitans, adoptiva, ontario, praepedita, New York",,0,344,1
Goulart M and M.Callisto,2005.,Mayfly diversity in the Brazilian tropical headwaters of Serra do Cip,Brazilian Archives of Biology and Technology,0,48,983,996,"Brazil, diversity, conservation, river ecology",,0,1018,1
"Grant, P.M. and K.W. Stewart.",1980,The life history of ^Isonychia sicca^ (Ephemeroptera: Oligoneuriidae) in an intermittent stream in North Central Texas.,,15,73,747,755,"Ephemeroptera, Oligoneuriidae, Isonychia, life history",,1,29,1
"Grant, P.M. and W.L. Peters.",1993.,Description of four new genera of ^Thraulus^ group mayflies from the Eastern Hemisphere and redescription of ^Simothraulus^ and ^Chiusanophlebia^ (Ephemeroptera: Leptophlebiidae: Atalophlebiinae).,,376,119,131,168,"Ephemeroptera, Leptophlebiidae, Atalophlebiinae, Thraulus, Simothraulus, Chiusanophlebia, Malaysia, Papua New Guinea, Philippines, Japan, Nonnullidens, Barba, Sulu, Magnilobus",,1,214,0
"Grant, Peter M. and Edwin C. Masteller.",1984.,New State Mayfly (Ephemeroptera) records from Pennsylvania.,,141,95,180,182,"Ephemeroptera, records, Pennsylvania, biogeography, Siphlonuridae, Ameletus, Heptageniidae, Epeorus, Leucrocuta, Nixe, Leptophlebiidae, Paraleptophlebia",,0,99,1
"Grant, Peter M..",1985.,A new species of ^Thraulus^ (Ephemeroptera: Leptophlebiidae: Atalophlebiinae) from southern India.,,165,68,424,432,"Ephemeroptera, Leptophlebiidae, Thraulus, systematics, new species, India",,0,75,1
"Gray, Lawrence J.",1981.,Species composition and life histories of aquatic insects in a lowland Sonoran desert stream.,,29,106,229,242,"Ephemeroptera, life history",,0,158,1
"Green, R.H.",1993.,"Relating two sets of variables in environmental studies, pp. 147-163.","^In^: G.P. Patil & C.R. Rao (eds.), Multivariate Environmental Statistics. Elsevier Science Publishers.",,,,,"statistics, multivariate, pollution, ecology, Canonical, Mantel, Procrustes, Cluster Analysis, Ordination, Correspondence analysis.",,0,367,1
"Green, R.H. and G.L. Vascotto.",1978.,A method for the analysis of environmental factors controlling patterns of species composition in aquatic communities.,,1841,12,583,590,"Ecology, statistics, cluster analysis, multiple discriminant analysis, environmental",,0,281,1
"Green, R.H., J.M. Boyd, and J.S. MacDonald.",1993.,Relating sets of variables in environmental studies: the sediment quality triad as a paradigm.,,1870,4,439,457,"pollution, contaminants, multivariate, statistical analysis, statistics, ecology",,0,366,1
"Guenther, J.L. and W.P. McCafferty.",2005.,Mayflies (Ephemeroptera) of the Great Plains. III:  North Dakota.,,376,131,491,508,"North Dakota, biodiversity, survey",,0,1042,1
"Guenther, J.L. and W.P. McCafferty.",2008.,Mayflies (Ephemeroptera) of the Great Plains. IV:  South Dakota.,,376,134,147,171,"South Dakota, survey, biodiversity",PDF,0,1111,1
"Gupta, S., R.G. Michael, and A. gupta.",1993.,"Laboratory studies on the life cycle and growth of ^Cloeon^ sp. (Ephemeroptera: Baetidae) in Meghalaya State, India.",,423,15,49,55,"Ephemeroptera, Baetidae, Cloeon, life history, life cycle",,0,250,0
"Haag, K.H., V.H. Resh, and S.E. Neff.",1984.,"Changes in the adult caddisfly (Trichoptera) community of the Salt River, Kentucky.",,1282,45,101,108,"emergence, Trichoptera, pollution, Kentucky",,0,386,1
"Hall, R.J., L. Berner, and E.F. Cook.",1975.,Observations on the biology of ^Tricorythodes atratus^ McDunnough (Ephemeroptera: Tricorythidae).,,309,77,34,49,"Tricorythidae, Tricorythodes, Tricorythodes atratus, life history, biology",,0,240,1
"Hall, R.J.; T.F. Waters, and E.F. Cook.",1980.,The role of drift dispersal inproduction ecology of a stream mayfly.,,132,61,37,43,"Ephemeroptera, Tricorythidae, Tricorythodes atratus, ecology, drift, dispersal, Minnesota, production, life history, life cycle, biology, ecology",,0,256,1
"Hall, Richard L..",1985.,New collection records of Ohio Mayflies (Ephemeroptera).,,141,96,171,174,"Biodiversity, Biogeography, Ohio",,0,127,1
"Hamilton, A.L.",1969,On estimating annual production.,,1831,14,771,782,"life history, life cycle, production",,0,57,1
"Hamilton, D.A. and D.C. Tarter.",1977.,Life history and ecology of ^Ephemerella funeralis^ McDunnough (Ephemeroptera: Ephemerellidae) in a small West Virginia stream.,,29,98,458,462,"Ephemeroptera, Ephemerellidae, Ephemerella funeralis, life history, ecology, West Virginia",,0,308,1
"Hamilton, S.W. and J.C. Morse.",1990.,Symposium: Origins of the southeastern Arthropod fauna.,,165,73,527,528,"Interior Highlands, biogeography, systematics",,0,384,1
"Hammond, P.C.",1995.,Conservation of Biodiversity in Native Prairie Communities in the United States.,,214,68,1,6,"conservation, biodiversity, native prairie",,1,465,1
